924890,John Bacon,2015-07-15 18:31:00,3277,https://www.facebook.com/210972522255883/photos/a.373576069328860.94148.210972522255883/1027329000620227/?type=1
924914,Fisherman,2015-07-15 21:42:00,7201,And then the fight started...hahahaha.
924915,lew,2015-07-15 21:54:00,12766,That's hilarious !!
924972,Dave Bailey,2015-07-16 05:33:00,1641,I've got double the problem. Try slipping a few aircraft model kits into the house. Wives have some sort of radar that detects them.
924974,wormdunker,2015-07-16 06:33:00,1711,"That's awesome!  I wish you had posted that on Monday when I came home with 2 new line counter reels, 2 rigger rods & a couple of dipseys!"
924986,bigbuck,2015-07-16 11:43:00,2449,Good one!!!
925036,davey buoy,2015-07-16 21:42:00,5505,Haven't used that one lol.Maybe I should ?
