1063336,300,2020-06-17 21:12:00,16,"Hello. I’ve never fished cooks bay. Want to go sometime this summer for bass fishing with my son. There’s a launch at Gilford I believe. I’ve goggled bass fishing apparently good at south end around pads and weeds. Not looking for spots, but is it good bass fishing. Thank you"
1063341,Terry,2020-06-17 21:29:00,14456,The gilford launch is residents only. So if you don’t live in Innisfil you will need to launch at a marina.     It is  possible that it could change  but for now no
1063344,300,2020-06-17 21:35:00,16,Ok. I just googled Cooks bay Marina.     Anything you can tell me about Cooks bay. Thank you
1063352,misfish,2020-06-17 22:20:00,29133,"I would tell you all his ""HOT"" spots,but he has none,,,,,,,,,,"
1063353,300,2020-06-17 22:27:00,16,Lol. Not looking for hot spots. Just asking if it’s good bass fishing there. Thanks
1063354,misfish,2020-06-17 22:31:00,29133,"Hit the mouth of the river. You will see many others doing the same. As for the bay it,s self,you need to know the area. Look for weed edges on drops.. Crank baits and senkos work best."
1063831,300,2020-07-02 23:39:00,16,Well it’s time on cooks bay with all the other boats. My son caught a couple  
1063832,Bill,2020-07-03 00:47:00,140,Nice catch
1063835,300,2020-07-03 01:12:00,16,Thanks. Might go back again. Lol. Not on opening day thou
1063871,captpierre,2020-07-05 13:18:00,2521,Those largies are decent but Simcoe is famous for its tank smallies. 4-5 lb not uncommon. They run in schools around sholes and islands at the top of Cooks Bay and elsewhere  on Simcoe. Find one you usually find more. Google it. There’s lots of info out there.
1063872,bushart,2020-07-05 13:43:00,2628,I hate when the fish interrupt my sandwich 😃
1063874,misfish,2020-07-05 14:54:00,29133,"Nice  Told ya it would be busy,and I see near the mouth."
1063875,300,2020-07-05 15:33:00,16,
1063876,300,2020-07-05 15:33:00,16,ya. Like a bass tournament. Lol. Thanks
1063877,300,2020-07-05 15:35:00,16,I did eat the rest. Lol
