315886,jat,2009-03-11 00:48:00,138,I was looking at the ones from Spring creek and was wondering if anyones knows where to pick them up in our neck of the woods. 2.tiff
315892,Terry,2009-03-11 00:52:00,14456,
315897,Greencoachdog,2009-03-11 01:01:00,8163,"They're actually called ""outriggers""."
315899,NAC,2009-03-11 01:04:00,369,SCOTTY makes them for kayaks and I believe canoes too.  But I'm pretty sure you'd need to order them.
315902,ccmtcanada,2009-03-11 01:08:00,7971,I cheaped out and made my own after having a heart attack when I saw how much they were charging for them....  Here's a post I made about how I did it... http://www.ofncommunity.com/forums/index.p...t=0#entry101009
315979,Diltsy,2009-03-11 05:10:00,22,"I have a home made pontoon may brother and I made for my canoe out of ABS pipe, works great. Where abouts do you live? I'm willing to sell it if you are looking for a cheap alternative."
315982,endless,2009-03-11 05:26:00,27,Diltsy:  do you have any pictures of it?
