681876,ch312,2012-03-30 03:51:00,1590," lmao...  so, just how many extra ounces do you consider MUCH heavier?  you might not be capable of shooting at those ranges, but many are. a sabot properly matched to your gun is more than capable at those ranges. anyone disagreing with that is stuck in the rifled slug/smoothbore"
681119,Rustic-Fisher,2012-03-28 18:23:00,826,A5 sweet sixteen ...... Now your talking upland gems.
681124,Billy Bob,2012-03-28 18:26:00,5865, And she's real PURDY.......   Some of the rest of the collection.... 
681127,BillM,2012-03-28 18:31:00,17367,Those humpbacks are the sexiest guns ever made!  I'll have to get some pics of mine and the oldmans the next time I'm up there.
681153,GbayGiant,2012-03-28 19:18:00,1780,My father has been a collector of guns for 60 years. I have shot ones with value and ones with out.  I know what I am talking about when it comes to a shot gun which will hold up and shoot with the best of them. It's the person who aims the gun and not the value of it. The guy wants to buy his first time shot gun. Not to start a dust collection. You can keep going on about what you know now.
681160,Sinker,2012-03-28 19:36:00,8692,"  :worthy:  Thank you. You clearly know what your talking about.  The rest of these guys are just bragging about what they use.  For a first shotgun, you can't beat an 870. First thing is to learn to shoot.....From there, the sky is the limit. I've gone thru some fancy guns, and I always end up with ole trusty when its game time. It also doubles as a push pole, paddle, pry bar or crutch if you need it  I don't even take care of mine. I didn't clean it once last season, and I hunt A LOT more than most, in some nasty conditions. Try doing that with your ""fine"" shotguns. Good luck!!  S."
681163,Billy Bob,2012-03-28 19:41:00,5865," That's nice your dad collects guns....I don't...But I have been shooting  them for over 40 years.....there are cheap firearms and then there are fine firearms....you get what you pay for....NO EXCEPTIONS......  Now I could of recommended what I shoot....LIKE YOU DID....but I didn't...I just tried to educate the OP on what to watch for when buying a firearm, as this is what he requested.....not what firearm I like to use.....maybe you should take your smart   back to the beginning of the thread and reread it as you already proven you know nothing about firearms to me."
681166,mercman,2012-03-28 19:47:00,7054," If theres one thing i know for sure, without a shadow of a doubt, is that rednecks know guns, and guns know rednecks. I would take BB's advice over many other son called gun collectors any day."
681176,Rustic-Fisher,2012-03-28 20:09:00,826,"Sinker, What makes the 870 the most reliable shotgun ever made? I have a few of them, as I collect pumps, particularly older ones. Just curious why you think this. R"
681178,GbayGiant,2012-03-28 20:16:00,1780, A scattergun is a scattergun. I'll stick to what works tried and true. If a shinny piece is what you like that is fine. I know you could put the best up against the 870 and lose only because the guy pulling the trigger has a shinny piece.   Just because you’ve shot guns for forty years doesn’t mean you can hit anything with them. The scattergun included of course.
681182,GbayGiant,2012-03-28 20:22:00,1780,  Oh quit your crying. BB's are what we are talking about. It would seem someone has their panities in a knott from an old PM messege.
681184,Billy Bob,2012-03-28 20:25:00,5865," I had to read that 3 times and I'm still not sure what point you're trying to make.....but you got one thing right....I'm not the best shot with any of my shotguns....but I'm better then average and I make up for my shot comings with my rifle....  But I will still stand on what I have been saying the ""NEW REMINGTON EXPRESS 870"" is crap.....it's actually a embarrassment for Remington who has a long a deep history making some of the finest firearms carried afield.....and don't get me started on the NEW REMINGTON 700's that they are putting out there...."
681185,misfish,2012-03-28 20:27:00,29133,  
681187,Billy Bob,2012-03-28 20:34:00,5865," OH MY, you do like to resort to personal attacks I see.....argue with facts not attacks is the best way to prove your point. Try it, you might like it."
681188,GbayGiant,2012-03-28 20:36:00,1780, It's always been the lowest model and cheapest for what it is. You still have to point and fire. Maybe you can now go back and read what the guy was asking for.
681190,Billy Bob,2012-03-28 20:42:00,5865, I understood his request and replied accordingly.....maybe you should re-read it as nowhere does he ask about Remington Express 870....
681192,aplumma,2012-03-28 20:47:00,6896,"10,9,8,......get back on track.   Art"
681193,Billy Bob,2012-03-28 20:49:00,5865, GOOD IDEA......
681196,mercman,2012-03-28 20:51:00,7054,"  NAH.............nah......s'all water off a ducks back now, or something like that ."
681209,jedimaster,2012-03-28 21:08:00,3472,"I never got why 870 guys get so pissy when people complaign about a new 870 express stovepiping a low brass shell. I have personally had a newer 870 express and it was terible. I did my reasearch and apparently the issue is with the new chambers of the new 870 expresses's....Notice I said new 870 express not the 20 year old ones... the new 870 expresses. Not the 15 year old one your papa gave you, not the one you bought in the early 80's...  Anyway the chambers are not polished enough and do have a reported and well documented issue with stove piping lowbrass shells. This is well documented and is not fiction made up.  It can be fixed by polishing the chamber, but that doesn't negate the fact that there IS a problem. I have also heard if you ram the son of bizaatch home hard everytime its very unlikely to jam. However in the field in the heat of the moment people will sometimes ginger it back and thats when they have issues. Now I can tell you this, my winchester 1300 speedpump would eject the shell on its own if you hold the pump with light back pressure. To get the next round in your just pushing forward. Smooth as butter. I have also shot a benelli supernova, and I liked it but the action is not nearly as smooth as the 1300's.  The newest batch of winchester pumps are also very smooth.  As for the auto 5's I think I must be the only one that thinks those things are gawd awfull looking monstrosities. Keep those ugly my mom hates me in the cabinets."
681217,misfish,2012-03-28 21:23:00,29133," When I first started with my rem mag express,I was using the low brass.(cheap) I did have issues with them. Jamming,not ejecting. When I went to the high brass,(which imo,is the better) I have had no issues. My rem 870 express mag is probly 15 yrs old,and shoots like it was new."
681218,Sinker,2012-03-28 21:28:00,8692,"I'm not getting pissy at all, and I'm a hardcore 870 fan. However, you are correct in what you said about them stove piping shells. You can't baby these guns. They are built to take a beating, and meant to be handled that way. Seems like the harder I am on mine, the better it gets. Mine is smooth as silk, and the action can be cycled with two fingers, but I still slam it as hard as I can every time! That's how they're meant to work!  In saying that, I know guys who have had issues with thier 870's. Most of them are super mags, but I have good buddies I hunt with all the time, who have converted from their fancy Beretta's, Benelli's and Franchi's to an 870 for reliability in the field. The guy I hunt with most has since bought 3 870's, and he couldn't stand them when we first started hunting. His Beretta was the first to go, after watching me pound ducks, while his was a single shot, then When his BRAND NEW Franchi did the same thing, he got rid of that, and now shoots an 870 with not a single issue.  I have another buddy who got rid of a Benelli SBE2 after 2 seasons, because it never worked properly from day one. Guess what he shoots now??  The bottom line is you can't go wrong with an 870 as your first gun. If you don't like it, sell it, and try something else. I wouldn't recommend the super mags though, they are the ones that seem to have the problems. The Magnums are fine, and you don't need the 3.5"" shells to kill your quarry. That is a fact!!  If you can find an older used one, that is the way to go. They are bullet proof, and will out live all of us!   S."
681222,jedimaster,2012-03-28 21:32:00,3472,Yup I agree go for an older used on in good condition over a new one and you will likely not be dissapointed. Just keep the shucker in shape or you will be cursing in no time.
681225,Rustic-Fisher,2012-03-28 21:37:00,826,New Winchester pump does look interesting.
681238,jedimaster,2012-03-28 22:04:00,3472,The inertia assited pump action system is amazing once you shoot it you will fall in love. Unless of course you like ramming every shot home as hard as you can. Fastest Pump action shotguns in the world. Made the 1300 Speedpump even better. They are worth a look.
681241,Sinker,2012-03-28 22:08:00,8692,"The winchesters are good too. I can't speak for the new models, but I have a 1300 that is just gathering dust, but its a great gun. I had a 2200 magnum that was worn right out, and still worked OK most of the time, but it did have the occasional hiccup.  I still say ya can't beat an 870 for a first gun, regardless. And Im sure there are many, many hunters that would agree. Easy to accessorize, lots of cheap and effective upgrades, and they will out last any one of us!  It would be nice if the OP would give a little more info on what he intends to do with it most. It makes a difference.  S."
680977,GbayGiant,2012-03-28 13:08:00,1780,870 Express hands down. From price to reliability it is number one. Put it up against the most expensive out there at a range and watch it ink ball targets. From Birds to big game at close range it can't be beat.  Enjoy
680978,backbay,2012-03-28 13:10:00,773," Never had a problem with seals in my auto loaders, myself, either in the field, ( I always prefered grouse hunting to ducks), or at the club."
680980,Billy Bob,2012-03-28 13:13:00,5865," Comparing the Remington 870 Express to some of the finer shotguns out there is like comparing a old 14' leaky tinny to a new high powered Ranger. But if that's all you have shot, you might think its a great shotgun....but it's not."
680981,Fang,2012-03-28 13:14:00,1330,been impressed with what I have been hearing about the benelli nova's and super nova's
680985,chessy,2012-03-28 13:21:00,610,Stay far away from the new remingtons.. i have 3 older ones in my gun locker excellent guns. the new ones are junk in my opinion i would look at mossberg  cheap and longer warrantee than remington  The warrantee center just stopped doing remington because of not honoring there warrantee.. now i think all guns have to be shipped to quebec
680988,Harrison,2012-03-28 13:24:00,2202,"Probably totally unfair, but I split the barrel on a mossberg 12ga. Saw the split just as I was about to put another round through it.  Can't help but be a little gun shy with them now. (ouch pun)  That being said a friend of mine got the 3 barrel Mossberg set, I never fired it but it felt really nice and the price is good."
680991,jedimaster,2012-03-28 13:34:00,3472,"Personally my favorite shotgun I have owned was a Winchester pump. They make the smoothest fastest cycle shotguns around. Cycle a few rounds through an express and a winchester and you will feel the difference. I have nothing against remingtons, but I have see alot of complaints recently about the Express line.  Honestly don't make up your mind online or based on someone elses review. Put a hunting jacket on, go to the store, and shoulder all the ones in your price range and the ones just out of reach. BPS, Winchester, Remington, Mossberg, Benelli's etc... Buy the one you would like to cherish, versus the one someone else said was good.  and BTW Congrats on the PAL, Welcome to the club."
680992,Billy Bob,2012-03-28 13:37:00,5865,PAL = Police Athletic Association here......what does it stand for in Ontario........
680993,chessy,2012-03-28 13:39:00,610, possession and  acquisition license
680995,NAW,2012-03-28 13:42:00,4022,"I aggree with that.  Likely the original seals.  And it's only happend once.   well.. Twice, but that's cuz I installed the seal wrong   Possession and Acquisition Licence."
680996,BITEME,2012-03-28 13:43:00,1968,870 fan  3 1/2 is a big cannon i run a 3 and it  will take out anything in this province  my 2 cents Peter
680997,Lip-ripper,2012-03-28 13:47:00,228,"Spend a few extra bucks and get a good gun. It'll be the last one you buy. I'd stay away from Winchester 1100's and Remington 870's as I have also heard about quality issues. Take a look at the Browning BPS... it's 10 times the gun. If you're in a gun shop, handle these 3 models. You'll know what I'm talking about. Remember, you get what you pay for."
680998,alexmedic,2012-03-28 13:52:00,186,Check this forum out:  http://www.canadiangunnutz.com/forum/index.php  Lotsa knowledge there!
680999,bigbuck,2012-03-28 14:06:00,2449,"I had a Winchester Ranger Model 1300 with a 28 and a rifled slug barrel. It was a great pump gun. If you can find one of those, go for it, it had a great action and I could shoot it almost as fast as a semi. You don't need a 3.5"" chamber, the ammo is expensive and it'll really beat you up. 2 and 3/4 is sufficient for most game and if you need to upsize, 3"" Magnum is plenty."
681005,Bernie,2012-03-28 14:24:00,3190,"Tried the Remingtons, can't shoot them. My cheekbones get in the way. Use Browning Cetari and a Browning Auto-5. Both take 3.5"""""
681008,Billy Bob,2012-03-28 14:30:00,5865," Many Browning Auto-5 don't take 3.5' shells and MANY MANY more don't take 3"" shells.......as a matter of fact all the Belgium made Browning Auto-5's are only 2.75"" chambers....HOWEVER, they are great shotguns and may be the best autoloader ever made....the original Belgium's if in good or great shape are sought after and get a VERY good price for them.....not uncommon for a real nice one to get $1000 or more for a gun that could be 40 years old or OLDER......even a beat up one is a fine gun in the duck blind or toted around for upland game because of how well they are balanced and point....not to mention how reliable they are."
681017,cityfisher,2012-03-28 14:51:00,959, +1  Got it on my 16th bday from my dad... I still use it !!! Keep it clean and treat her well and she will last forever.. i will never sell it...maybe a semi one day but my 870 does the job very well!
681023,jedimaster,2012-03-28 15:09:00,3472,"Don't overlook Stoeger double guns if your looking for a hunting gun. I just picked up a condor outback over under. Nickel and black walnut. I love it. Removable chokes, fast to shoulder, light and few moving parts to jam up. Heck even fpsRussia likes this gun and has one. In the field I can get off 4 shots faster than you could get off 4 shots with any 3 round pump gun. Don't forget when hunting in ontario with a shotgun you are limited to 3 rounds max. Plus I just think a double gun looks cool.  "
681025,ch312,2012-03-28 15:16:00,1590,"another 870 fan here, but i did buy mine about 8 years ago or so. i highly recommend you buy an older 870 that's in great shape (relatively easy to find) as scatterguns simply get better with use. mine has been submerged in mud and water, dropped in sand and dirt, and banged off many trees without a single problem. with an 870 you'll have the most options for aftermarket accessories, easy access to parts, and tons of how-to's online if you're going to mod it.  3"" vs 3 1/2""? considering the price difference is so minimal it makes little sense to choose the 3"" over the 3 1/2"" chamber. weight and size of both guns is the same. patterning your shotgun is huge and finding the load your gun likes is very important so a 3 1/2"" chamber allows many more options. shell A in 3"" may shoot better than shell A in 3 1/2"", but shell B in 3 1/2"" may throw much tighter patterns than the same shell in 3"". best to pay a tiny increase in price now rather than buying a 3"" gun and wishing you had the 3 1/2"".  while the 20 gauge is a great gun and can be used for the same critters as the 12 gauge, the 12 gauge is better in all departments. ammo options, increased range, and significantly more pellets makes the 12 gauge better for most.   lastly, consider purchasing a rifled barrel combo. you'll get a smooth bore with your gun for shot/rifled slugs as well as a fully rifled barrel which permits the use of sabot slugs. with this combo you'll have everything from squirrels to moose covered and your equipment will be capable of taking deer out to 175-200 yards IF you find the sabots your gun likes. mine preferred 2 3/4"" copper solids which would make nice little 3"" outside to outside (center to center = 2""?) groups at 125 yards with a scope off a solid rest."
681038,Billy Bob,2012-03-28 15:58:00,5865," OH WOW, I don't know where to start......lots of mixed up info here....  First if you just purchase a Remington Express 870 it will be chambered for 3"" shells and of course 2.75"" shells.....if you want a  Remington 870 that is chambered for 3.5"" shells you will need to purchase a Remington Express 870 Super Mag.....even the Remington Wingmaster (a very fine gun) is only available in 3"" chambers....all of these firearms will show what shells can be fired on the barrel.  The price difference from a 3.5"" shell to 3"" and 2.75"" shells is significant IMHO......take a box of Federal Blackcloud ammo for duck hunting...Using Cabela's site....3.5"" cost $27.99 per box compared to 3"" at $22.99 per box or 2.75"" at $16.99 per box....that adds up real quick during a long season of waterfowl hunting.....this is why many guys soon after purchasing a 3.5"" chambered shotgun tend to get 3"" shells after the first season with their new shotgun.  The 3.5"" chambered shotgun is much heavier and overall larger to accommodate those heavy hitting magnum shells....  And last but surely not least......NO ONE should EVER use a shotgun to fire at a deer at 175 to 200 yards......that a distance a fine tuned rifle can only make with the right skilled hunter pulling the trigger. Wounded whitetails can go MILES when hit by a poorly placed shot, even with large caliber rifles. A 12 gauge sabot slug sighted zero in at 100 yards drops off 9.9"" at 175 yards and I have no idea how much more it drops at 200 yards....either way that is not a shot I would ever attempt with ANY shotgun. It's just not a response-able shot anyone should make.  Happy Hunting, Bob"
681043,NAW,2012-03-28 16:09:00,4022," I've never tried my slug gun at anything further then 100 yards.  But it realy like the Hornady SST Slugs.  Very tight patterns at 100.  Like I said, I've never gone further then that, and likely never would in the field.  To much target practice with expensive shells to get that good!  http://www.hornady.com/store/Slugs/"
681071,BillM,2012-03-28 17:14:00,17367," Ugh, BB we really gotta stop agreeing with each other, we might become BFF's!!!   One of the softest shooting 12 gauges ever made if it's setup properly.   My oldman has a Auto-5 dated in the 50's (It was a European market gun, so no scroll work on the receiver)..  I was just given a Auto-5 that dates to the early 40's...  It will be buried with me, lol."
681072,troutologist,2012-03-28 17:18:00,951,"Just went through this last fall. Ended up on a Benelli Super Nova, because I wanted something more geared to waterfowling.  Thought alot about the BPS, probably the nicest gun of that price range in pumps, still heavy in 12ga to carry all day in the uplands.  I was told by a number of serious gun folks to stay away from the current Express and Nitro Mags....lots of issues apparently at gun shops.  Best plan is to think about what you will be doing, if its upland walking, I would look mostly at the weight. I carry a 28ga for grouse hunting in the bush, a please to carry all day vs something in the 8lb plus range.  The nova/super nova are not pretty but they are really nice guns, field strip simply and have not had a hint of a cycling issue thus far."
681090,Sinker,2012-03-28 17:40:00,8692,"I just did the math, and I put 2150 rounds thru my 870 Express last fall alone waterfowling.....and I'll do that again on clays easily in the off season. Not one misfire, jam or otherwise. I've never actually had it jam or misfire. They are great guns. I would suggest the Magnum over the super mag. It seems like the newer super mags are the ones with the reliability issues. I've shot beside guys shooting 3.5"" shells, and my birds are just as dead as thiers are. If you can center your target in the pattern, within range, any size shell will kill. Dont get thinking that a 3.5"" shell is going to kill things further, or deader, because they don't. They ONLY add pattern density, not range. The pellets are still traveling the same speed as a 2 3/4 shell, only there is more of them.  Go in to a gun shop, pick up a shotgun. Look at a target on the wall, close your eyes, and point the gun where you think that target should be. How far off were you? Try another gun and repeat. The gun that puts you closest to the target with your eyes closed is the one you should get.  Fit is far more important than chamber size or anything else. If the gun fits, buy it. They are all pretty reliable.  There are a lot of things to consider.....what do you intend to hunt with it the most?  The Express will rust if you put it away wet, but it will never skip a beat. Why do you think all the police forces have an 870 in all their patrol cars?  I've tried just about every semi auto made at some point or another, and I've seen their owners all let down at some point or another, while I keep banging away on my ugly, rusty, 870.  Whoever is saying the 870s are no good, have thier heads up thier   , because they are probably the most reliable shot gun ever made. And yes BB, I've seen many brownings turn quickly into single shots as my 870 plugged away.  Take an A-5 out in a muddy, wet corn field and see how long it lasts as a semi....I bet its a single shot, long before mine is  Anyone who does this stuff knows that a wet muddy field is the worst place for any semi, and a pump gun is far more superior.  Anyways, thats if from me. I'm getting out of this one while I can   S"
681094,Billy Bob,2012-03-28 17:45:00,5865," Yes, it takes the fun out of us  arguing.....LOL  I have a Browning Sweet Sixteen that was my second guy I ever purchased brand new in 1974 (1973 model, it's stamp on the stock if you remove the steel butt plate)....I paid $314.00 then.......now you can purchase a Remington Express for around $200.00....that alone should tell you what you're getting in today's market.....today that Sweet Sixteen would fetch a easy $1000.00 and I would have guys fighting over it as it's in near mint condition.  The Browning Auto-5 is a recoil operated autoloader compared to today's gas operated models....it gives you a push rather then a kick is the best way I can describe it......you have to shoot a Browning Auto-5 to appreciate one.  Now that's not to say all Remington's or Mossberg's are junk...as they are not....but the newer models they are now selling....well I wouldn't want one.....but for a newbie he will think it's the cat's meow....until someday he fires a fine firearm.....then that crowbar will be a under the seat truck gun.  I have 19 firearms in total.....why 19 you ask....because I didn't have money for the 20th one......along came kids and they needed shoes, clothes.....college....all that useless stuff kids keep bothering you for...."
680906,chris.brock,2012-03-28 04:03:00,4053,"I just got my PAL, I'm looking for a reliable, all purpose shotgun. I was thinking a Remington Nitro Mag. I'm not sure what I'll be doing hunting wise, so I'd like to keep my options open. I like the 28"" barrel, Rem chokes and 3.5"" chamber. I can also buy a rifled slug barrel. any advice/ opinions would be appreciated."
680907,Guest ThisPlaceSucks,2012-03-28 04:04:00,0,my favourite gun is the classic remington wingmaster.  i'm not a big gun nut though so i'm sure there's far more technical opinions out there.
680908,HTHM,2012-03-28 04:06:00,4082,Look at the Mossberg package as well. My son in law has that and quite likes it.
680912,chris.brock,2012-03-28 04:29:00,4053,"yeah, a buddy at work recommended the wingmaster, it's 2x the price of the nitro mag though"
680913,backbay,2012-03-28 04:34:00,773,"Check out a Maxus, they're reliable. My Remington 1100 has always been good to me, but it was made in the 70s, a good period for Remington. The most important thing imo, though, is to find a gun that feels right to you when you shoulder it."
680915,Sinker,2012-03-28 04:44:00,8692,I'm a dirhard Rem 870 guy. Never been let down.  S.
680921,Guest ThisPlaceSucks,2012-03-28 07:46:00,0, classic.
680922,Chuck Best,2012-03-28 09:28:00,308,"Check into Mossberg combos,I got me a 3 barrel combo.Rifled slug,turkey and field barrels,3 guns in one,and I'm very happy with mine.....TC and tight lines....Chuck..."
680924,moose,2012-03-28 10:17:00,266,the 870 express is the all round shot gun that can do everything from changing barrels to chokes and priced reasonably
680926,Harrison,2012-03-28 10:59:00,2202, X2
