681879,ch312,2012-03-30 04:08:00,1590,"does buying a 3.5"" gun mean you always need to use the more expensive bigger shells? i dont think so. but, its nice having the extra capacity they provide when using buckshot, steel, and turkey loads. basically, its nice having the extra pellet count when you need it. a 2 3/4"" gun can do anything a 3 1/2"" gun can, but the bigger shell often produces superior patterns.  175-200 yards should never be attempted with a shotgun by anyone and only a fine tuned rifle is capable of those ranges? new to firearms, are we?"
681899,dave524,2012-03-30 11:50:00,4508," I shot the first southern Ontario controlled hunter number shotgun hunt in 76 or 77 , back when shotgun slug technology was pretty much the antiquated Foster type slug in your favourite bird gun. Since the start of the controlled hunts, muzzleloaders have always been an alternative to a shotgun and at that time a far better choice for accuracy and range. Slug gun technology has come a long way since then but 35 seasons and a lot of deer later I have never regetted sticking to the old smokepole, just another option few consider for the southern Ontario deer hunts. Why hunt with a shotgun when you can use a real rifle"
681901,Billy Bob,2012-03-30 11:58:00,5865," OH, OK......I'll play along.....since I know nothing about those new fanged dangled things they call sabot slugs maybe you can teach me....  But I do know that a sabot slug muzzle velocity ranges anywhere from 1400 to 1700 fps....remember I said MUZZLE velocity.....with a range of 1700 to 2400 foot lbs of energy at the MUZZLE....quite impressive to start off....right.  But here's where it gets a little baffling for me at least....at a distance of only 125 yards those sabot slugs have lost a lot of energy and velocity (by the way this is the recommended limit for slugs) and now that same slug is down to about 1100 fps and foot lbs of energy has been reduce in about HALF.....now that's at 125 yards....once you get beyond that distance the speed of that slug and the energy behind it REALLY drops off....  Now going back to your recommended distance of 175 - 200 yards the energy and velocity (speed) of those new fanged dangled slugs are really dropping off....as a matter of fact I already mentioned at 175 yards that slug will drop 9.9"" on a GOOD DAY....at 200 yards I would have to estimate it over 15""....  So with all that scientific infomation available to us how high would you have to aim in order to put that new fanged dangled sabot slug into the boiler room of a whitetail deer ? ? ?....OH WAIT....we forgot about wind drift didn't we....huh, who would of thought that a small wind of only 10 miles per hour could move that new fanged dangled sabot slug out of the killing zone....wait wait....I did....Ballistics have shown us that a MILD 10 mph cross wind will move that slug over about 6"" at 125 yards....so at 200 yards that calculates to at least 1 FOOT left or right of the aim target....  So now how are you going to aim at the distance of 200 yards a that deer in hopefully a clearing with no other hunters around.....  Well my new fanged dangled sabot shooter has a 2.5X scope on it with a special eye relief that shotgun scopes have because of the BRUISING kick these 12 gauge shotguns deliver while shooting any kind of slug....but you know what......2.5X scope is really not made to make shots at 200 yards....but you could use a rifle scope with a eye relief of 3-4"" and take the chance of that scope leaving a bite mark on your forehead....if I met you I could probably tell if you had the pleasure of this experience as many times the scare is still there.....but maybe you are using the improper scope and keep you head and cheek back to prevent this...only problem is now you don't have a good cheek weld to the stock and in doing so you will never become a good shot, not to mentions a sharpshooter that is needed to pull off this stunt....YES I said STUNT because it is very irresponsible to shoot at a whitetail deer at 175-200 yards with a SHOTGUN....even with those new fanged dangle sabot slugs I know nothing about according to you sir.  BTW the ESTIMATED answer would be depending on the cross wind direction and which way this whitetail is looking and HOPEFULLY he is completely broadside for this stunt shot.....15"" high and about 12"" right or left depending on wind direction.....GOOD LUCK with that......but if you can make that shot I am willing to invite you down to my gun club range to witness this.  As far as the weight of the gun....I'm not even going to address that...  Good Luck Hunting, Bob"
681902,GbayGiant,2012-03-30 12:10:00,1780,I have to agree with Bob in this situation. If you plan on shooting over 100 yards with your shotgun. Buy a rifle.
681903,BillM,2012-03-30 12:11:00,17367,I'd like to see all these guys dropping deer at 200 yards with a shotgun.   Talk about internet heros!
681904,dave524,2012-03-30 12:15:00,4508, Muzzleloaders are legal in controlled southern Ontario hunts
681909,GbayGiant,2012-03-30 12:20:00,1780, The number one reason why I do not except venison from other people. Can you say gut shot? Would you eat meat that was dropped in scat and washed?
681910,GbayGiant,2012-03-30 12:21:00,1780, That's a Muzzle load all right....
681912,Billy Bob,2012-03-30 12:38:00,5865, Although I never got into the muzzle loaders....this would be a much better choice for a 175-200 yard shot then any shotgun....  Are you guys up there allowed scopes on those smoke poles....some states down here prohibit scopes on muzzle loaders.....but not NYS.
681928,Sinker,2012-03-30 13:22:00,8692,"Yeah, scopes are good to go. We use them for turkkeys on our scatterguns as well.  S."
681970,Cookslav,2012-03-30 15:37:00,1457,"In the Hunter Safety course the reccomendation from my instructor as an effective range for a Sabot Slug through my 870 Supermag was ""not more then 150 yards."" Thats not by anymeans my recommendation....its just what I was told when I asked.  I personally don't think I'd squeeze the trigger if I had more then 100 yards between me and my Deer... My grouping tends to be about 4"" at that range (which I am aware is poor... )  I use Buck shot when driving for the obvious and Sabbot on the stand. But my in the ravine 30/06 is prefered for the longer shot."
681981,Billy Bob,2012-03-30 16:32:00,5865," Not really.....4"" groups at 100 yards is pretty good on a solid rest and is fantastic off hand for shotgunning....you'll bring a lot of venison home if you can do that day in and day out.  What makes shooting a 12 gauge shotgun accurate with sabot slugs is not only the pounding you take from each shot but also the expense for each sabot shell.....a box of 5 sabots will cost you about $20 ($4 per shot) where a box (20 per box) of your 30/06 shells can be had for about the same amount $20 ($1 per shot) unless you reload your own. And as ch312 did state, some sabots shoot better then others and you really need to try to find which one fires the best out of your rifled barrel.....and that can depend on the twist rate of that barrel....by the time you find the best one your shoulder is all black and blue and your broke...LOL..."
681990,Cookslav,2012-03-30 16:54:00,1457," Day in and out...not a chance, thats a good day, and I'm happy with that when I get there LOL! My Dads groupings are usually 2-3""...maybe I measure myself to to high a standard But then again our range may not be 100 yards ""exactly""...maybe I'm a horrible estimator and it's 70 LOL!!! (its a hunt camp....and it looks to be 100 yards give or take)  One thing for sure...sighting in sabots tend to leave a bruise"
681993,ch312,2012-03-30 17:04:00,1590,"  your post so full of fail  going by your train of thought you need a finely tuned rifle to shoot at 200 yards. i guess you arent aware that $100 milsurps, new rifles with a whopping $300 price tag, and even the lowly 22lr (mainly prairie dogs) is used by some hunters at these ranges. i guess you're also unaware of people successfully taking deer at these ranges with the slower and less powerful 20 gauge?  btw...you might want to have a clue what you're talking about before labeling yourself the next craig boddington.  winchester xp3 3"" sabot throws a 300gr slug at 2000 fps with 7.3"" drop at 175 yards. at 200 yards its still traveling 1380fps with 1260ft/lbs of energy and 10.5"" drop. considering 7-800ft/lbs is the minimum recommendation for deer sized game, you're good to go. a 10mph crosswind makes it drift 11"". winchester 3"" partition gold is even better at 200 yards. 1400fps, 1656 ft/lbs of energy, 11"" drop, and 10"" drift at 10mph.  thats assuming you're using a 100 yard zero. but, for these ranges a 150 yard zero would be much better as the drop at 200 yards will be 6-7"" and 2-3"" high at 90-100 yards. if you arent capable of compensating for a 6"" drop or 10"" drift, then i'll agree that you shouldn't be shooting at longer ranges. your ""estimated"" 15"" drop and 12"" drift is a far cry from 6"" drop and 10"" drift.  the guns are capable. the ammo is definitely capable. the last part of the equation is the hunter.  that said, i havent shot a deer past 100 yards because i prefer to get close. BUT, to come on here claiming that modern shotguns and ammo arent capable of 200 yard shots is absurd. like i said, get with the times. im not talking about using grandpas smooth bore with rifled slugs here. i'm talking a modern shotgun, fully rifled barrel, your preferred scope, and premium ammo.  2.5x scopes aren't good enough, so you have to use a rifle scope with lower eye relief? what on earth are you talking about? there are multiple 1.75-4x, 2-7x, 3-9x shotgun scopes available with longer eye relief for shotguns.   as for the weight differences. you're right, you shouldn't go there. i've shot many 3"" and 3 1/2"" guns and the weight difference is so minimal it isnt even noticeable while you're holding it.  3"" rem 870 express 28"" barrel 7 1/2 lbs 3.5"" rem 870 express super mag 28"" barrel 7 1/2 lbs  3"" mossberg 500 7 1/2 lbs 3.5"" mossberg 835 7 1/2 lbs  just to clarify, exactly what do you consider to be MUCH heavier?  like i said, you're going by technology or what you were taught 20 years ago..."
681997,ch312,2012-03-30 17:14:00,1590," im not trying to start a conflict here, but if you're getting a bruised shoulder from shooting you need to work on shooting form and possibly get your stock modified to fit you properly. not only will it help your body absorb recoil better, you'll often be a more confident and accurate shooter.  as for cost of slugs. considering most guns are close to zero after removing and remounting the scope and rifled barrel, it should only take a box to get back on zero and another box to make sure everything is proper. so, figure 2-3 boxes for the average guy shooting average distances. considering how much most hunters spend on gear, tags, gas, etc, $50-60 for 3 boxes of premium ammo isnt very expensive at all. why do people spend hundreds on a nice fishing rod when an el cheapo from canada tire will work? it's the exact same thing...people pay a premium for performance.  rifles are much cheaper, but around here we're limited to muzzleloaders and shotguns for deer. therefore, the more economical choice is a shotgun with rifled barrel."
681998,Billy Bob,2012-03-30 17:14:00,5865,BEAUTIFUL....would you like to join me at my gun club and put those ballistics to the test on the range and see how well you do....  I do a LOT of long range shooting at the range and in the field during woodchuck season.....I would love to shoot with you.  Bob
681999,Billy Bob,2012-03-30 17:17:00,5865,"And you can bring whatever gun you like......shotgun, smoke pole, rifle or you can use one of my pistols if you wish....we'll start at 100 yards and move back 25 yards each time...."
682060,ch312,2012-03-30 20:43:00,1590,"well, you'll have to wait until august or september when my new slug gun will be in my safe. i hunt quite a bit for pretty much everything out there, so i didn't like having my shotgun dedicated to deer for 2 weeks every season (shoot a few days before the season and season lasts 1 week). therefore, i'm switching to a dedicated slug gun. many reports of 4"" groups at 200 yards from savage and NEF shooters    while i'll probably never shoot a deer past 100 yards, i have zero problems paying for accuracy and range. i'm hoping i'm not going to regret selling my 870 combo that produced those purdy little 2"" center to center groups at 125 yards...  considering i sent a few hundred sabots down that tube, i'm fully aware of how i'd do at those ranges and it's only gonna get better once i get the new gun dialed in.   the fact is, you're arguing when you clearly have very little experience with shooting different slug guns and your statements reflect that. i could care less how often you shoot or what you shoot, we're talking specifically about shooting sabot slugs. go send 3-400 sabots of all the major brands you can find and it'll open your eyes as to what a properly matched combo is capable of. sure it's expensive, but shooting them is a hoot.  i really don't understand why you're so full of doubt when i posted the numbers for you. just because you're not comfortable or capable of doing something it doesn't mean everyone else is the same. while i'm against long range hunting (500 yards+) and can't shoot that good, there's other people out there with machine like precision that can do it all day. just like some can accurately shoot slugs at 200 yards, while others can't."
682081,GbayGiant,2012-03-30 21:44:00,1780,  Fitting.
682090,misfish,2012-03-30 22:04:00,29133," Quit while you think yer a head BB.  This guy knows what he,s talking about.Read alot of his posts,here and there."
682111,waterwolf,2012-03-30 23:25:00,556,
682118,waterwolf,2012-03-30 23:51:00,556,"870 express? for the money? absolutely!! this is a great firearm that won't say quit.has never let me down! more expensive toys may look nice on out-of-the-case-brag day but it's all attitidude, pissin contest.i was closin bow season, passin the torch to the shotgun guys in the same area, when i met a guy was braggin about his over-under ,$4000 benelli.broke the gun to show off the smooth action only to reveal it was still loaded from last year! it's the gunner ,not the gun.    be safe guys n gals."
682128,brkygetr,2012-03-31 00:22:00,425,"I read this post earlier when it was under 2 pages. I noticed the pages and quite honestly did not read another post. All I have to say is 'BPS'. You want a smooth gun, reliable, interchangable barrels/chokes and an acceptable breach for all shells, this is it. Rubberized stock and pump is also nice, especially when its crappy out or you are slugging through the bush. Holds on REAL well. Just my opinion mind you. If not get an 870."
682243,farsider,2012-03-31 13:57:00,456,"Thanks to your advice I checked out Canadian Gun Nutz.  They have an incredible thread about shortening PAL approval times.  I only wish I had known about it sooner but I will still be able to use the ""calling in your references"" part.  I am still going through it all(It has many pages).  Anyways, here is the link for those in process or soon to be:  CDN Gun Nutz  Cheers, Mark"
681256,Bernie,2012-03-28 22:50:00,3190,"You are correct BB. My auto 5 is only chambered for 3""."
681262,misfish,2012-03-28 23:11:00,29133,"Semi,s are for lazy mothers.Ya it,s easy to trigger, trigger, trigger.But,pump,trigger,pump,trigger,pump.trigger.That,s a shooter. IMO  It,s easy to just go, BANG,BANG,BANG,BANG,BANG.  "
681266,farsider,2012-03-28 23:22:00,456,"I also just completed my Firearm safeties, just waiting to mail in my application (restricted and non).  I have also had my eye on the 870 combo from Lebaron's.  Where would one find a used 870 for sale?  I was hoping to be ready to hunt this fall.  Or if I can find a loaner, turkey this spring. Scratch that last part.  I guess I will have to wait until my license comes in  Cheers,  Mark"
681272,jedimaster,2012-03-28 23:44:00,3472,"ellwood epps, williams arms and gagnons all sell used guns. The other place you coulch check is canadiangunnutz.com or one of the other fishing websites also does hunting stuff. Your best price on a used 870 will come from a person that just bought a winchester... baaahaha"
681292,Rustic-Fisher,2012-03-29 00:21:00,826,"Remington 870 EXPRESS PROS-  Receiver is milled from solid steel,Tons of add on's and upgrades available, easily disassembled for cleaning, great combos available for a good price. CONS- Quality has slipped in the last few years, Rust is a problem, laminated stocks tend to swell when wet, single shell extractor.  Mossberg 500 Pros- Dual shell extractors, Tang safeties,  Great combos available, easily disassembled for cleaning, passed US military testing (includes 3000 rounds of 00 buck down the pipe) becoming a standard issue shotgun before the Benelli M4 S90. CONS- Aluminum receivers (i prefer steel), camo paint flakes off, plastic safety and trigger guard (military spec is metal)  BPS Pros- Bottom eject for the lefties out there guys beside you in your duck blind will thank you, great walnut stocks with nice bluing on all metals, back bored barrels, tang safeties, Milled steel receiver. Cons- Little bit more in price but still cheaper than a Wingmaster,  weight, ad on's extra barrels are big $$, disassembly for cleaning can be a pain.  I havent shot Benelli Nova's enough to offer opinions on it, the Super Nova seems pretty slick thou amazing how it soaks up the recoil from a 3.5 shell.  I have a few M12 Winchesters that are great, love the slam fire on them (hold the trigger down and pump).  As stated before, these guns (870,500,BPS) if maintained and used properly will out last you, and for the price you don't have to worry about dog scratches, dinging it of rocks, rain, and all  the other crap you put it through. Thats my 2 cents"
681311,BillM,2012-03-29 00:44:00,17367," If that's the case, over/unders must be for superheros!!  LOL  Gimme a semi over a pump any day."
681324,Cookslav,2012-03-29 00:57:00,1457,"  Put another down for the 870... I have and 870 supermag and not a single issue, jam, misfire are what ever. Probobly not the ""best"" gun out there but it works well, and is not a bank buster either.  As far as an ""all around Shot gun""...it fits that critera well. Seems to be pretty popular, so thats gotta say somthing....just say'n"
681328,backbay,2012-03-29 01:09:00,773," handy when you're shooting doubles....    Jaspers On Point : I have a few M12 Winchesters that are great, love the slam fire on them (hold the trigger down and pump).  I used to do that when I was a kid!"
681333,Dabluz,2012-03-29 01:21:00,701," Hi Chris.  Lots of good info here.  I also do not recommend a 3 1/2 inch chamber.  3 inches of chamber is lots.  Yes....the 12 gauge is the all purpose shotgun.  A 28, 20 or 16 gauge shotgun shoots pellets just as fast as a 12 gauge and for the same distance and at full choke all will put 75% of their pellets within a 30 inch circle at 30 yards.  The only difference is the number of pellets, and the weight of the gun.  Yes....you have to consider how much you want to pay.  Yes, it's nice to have a fine grade shotgun but you get so worried about scratching it that it can remove some of the fun.  The 870 Remington with the black plastic stock and 3 inch chamber, variable choke tubes is still a good buy.  I forget the model name but every gun store has a few of these in stock.  Yes....these pump action guns will get smoother with age.  I guess they are not as good as they once were but I doubt they are not all that bad either.  Only the people who have had problems speak out.  The 99.9% of those who have never had any problems never gripe about their buy. Yes, you can buy a rifled barrel for the 870 with no problem.  Try out the smooth barrel at the rifle range to see if you really need the rifled barrel.  If you don't like cleaning a shotgun after every outing, buy a single shot 12 gauge.  However, you will not get the variable chokes etc.  If you love to take apart and clean your guns after every outing then you could buy a semi-auto.  For waterfowling, the pump action 12 gauge shotgun is the most popular by far."
681386,chris.brock,2012-03-29 03:03:00,4053,"hey, be prepared that it could take alot longer than the 45 day maximum the RCMP says it will take to actually get your PAL in your mailbox, mine took about 3 months and I was calling/ bugging them consistantly near the end."
681388,BillM,2012-03-29 03:06:00,17367,Mine took about 50 days from the time it was received.
681391,chris.brock,2012-03-29 03:13:00,4053,"thanks guys for the opinions, seems like people are pretty passionate about their guns. I'll go down to Lebarons one day soon (I understand the older models are better built, but I want my 1st gun to be new), I'm still leaning towards the Remington despite the naysayers, they have the 870 express with a 20, 23 and 28 inch barrel trio, 3 inch chamber for $534 (I get 10% off with my members card thing), I'll take a look at that and whatever else they show me, thanks again for the info"
681392,chris.brock,2012-03-29 03:15:00,4053,"we don't really do the ""under the truck seat gun"" thing here in Oakville"
681395,Sinker,2012-03-29 04:02:00,8692,  That combo is enough gun to kill anything in Canada!  Ya can't beat the price!  S.
681493,BITEME,2012-03-29 14:02:00,1968,Let the slamming begin  Okay i have got to come clean here a bit. I do like 870 but about 10 years ago I bought a norinco 870 knock off with an extra rifled barrel for about 315 out the door I sent the smooth barrel up to epps had the forcing cone opened up and had it laser ported ports are up and back cut I have to say i dont shoot any thing else and I have stoned a wide variety of critters with it. It is a continual winner at turkey shoots and cleans up nice all you got to do is be nice to it it has stayed tight its in 3 inch and probably had a few thousand rounds anyway I have never had a jam the only other things i did to it was put a pistol drop on it and a red dot I did that before it was ported kick is very minimal it was a mule before. all this was done for under 600(total price of gun included) pardon the pun it is a bullet proof gun. Im not a big fan of made in china but I looked at it this way they have been playing around with stuff that goes boom longer then anyone else. I bought it from a shop in hamilton cant remeber the name though you have to buzz the door to get in.  Just my 2 cents  Peter
681497,NAW,2012-03-29 14:15:00,4022," Just to save you some time.  I called a few places (Tremblays, Epps, BPS).  Nobody would price match the $534 at Lebaron.  Walked out of there with a new gun, scope for the deer barrel, sling, and hardware for mounting everything for under $800 tax in."
681498,BITEME,2012-03-29 14:17:00,1968,  nope cant argue there
681541,Billy Bob,2012-03-29 15:43:00,5865," You could of saved yourself a lot of time and MONEY by just purchasing a Mossberg 500 slugster......barrel is already ported, fully rifled with cantilever mount for you Red Dot or you can choose one that has only rifle sights on it....and it's made right here in the U.S.A.  and out the door for less then $300 or about $350 with a bird barrel and 3 factory chokes included...."
681581,richyb,2012-03-29 16:30:00,774,The guys I know that own the 870 love them.
681621,BITEME,2012-03-29 17:46:00,1968,  Could of Should of Would of but didnt Im still a happy boy and will go toe to toe with it against any other shottie ....remember its the shooter and the gun helps a bit  Peter
681741,farsider,2012-03-29 22:25:00,456,"Thanks for everybodys input.   Thanks Chris.  My instructors gave me the lowdown as well.  2 to 12 weeks to get my test results back from RCMP, only so I can  mail in my application...to the RCMP.  28 days to 3 months to get my license back.  Thats why I had sort of resigned myself to fall.  I was under the impression that Lebaron had the exclusive on the three-barrel combo.  Let us know how you like it.  What range will you shoot it at?  Cheers,  Mark"
681841,cynmar,2012-03-30 02:19:00,169,"I have a Remmington Wingmaster with a 36"" ribbed goose barrel. This is a beautiful gun especially since my father bought it for me when I was 15. Now at 60 years old it's still beautiful. Not a big hunter , more of a fisherman but it is a great gun for my length of arm when skeet shooting.  Bill"
681859,Dabluz,2012-03-30 03:05:00,701,"In 1996, my house was visited by robbers and they stole my firearms.  Anyway, the insurance company covered my losses.  To replace my old Savage 67 pump, I bought a Remington Magnum Express 870 (3 inch chamber).  This is the black model with synthetic stock.  It was way better than the old Savage but I only shot a few rounds out of the 870 because I was too busy fishing in the fall to go duck hunting.  I sold it along with 3 choke tubes last year for 350 dollars.  It was in mint condition.  The new owner is very happy.  I even sent it to the motel where he was staying so he could use it while on his fall hunting trip.  I still do a lot of small game hunting but I have a 28 gauge Remington single shot with a legally chopped off barrel.  And I still have my Winchester model 59 12 gauge autoloader with a fiberglass barrel.  It's terribly light and fast."
681867,danc,2012-03-30 03:20:00,4677,"I bought my Mossberg 500C 20 guage pump brand new almost 40 years ago for $95.00. Several hundred Grouse later, it has not failed me ever. I love that gun."
