255297,Pachone,2008-10-04 02:48:00,276,Hey guys..  Im trying to get out tomorrow morning in the waders to hook on some salmon... but I need Bait!!!!  Does anyone know where I can get Bait late night or as early as 7AM? Im looking for Roe or Worms!   Im located on the east side... in pickering. but im willing to travel to grab some... Ill be going east towards lindsay area for the fish... so yea!  Any help is appreciated!! THANKS!!  Pachone
255303,dp3200,2008-10-04 03:02:00,31,Just take a flashlight out tonight and check around the grass in your yard or a nearby park. The worms come right out onto the ground. The light and your footsteps will spook them back into their holes so move quickly. Good luck!
255327,Toronto_Angler,2008-10-04 04:32:00,698,Lucky tackle at Sheppard and Midland in scarborough is open 24/7
255329,KelfuN,2008-10-04 05:26:00,246, they aren't opened 24/7 anymore since the last time i checked (2-3 weeks ago). im not too sure about weekends though.
255457,Rich,2008-10-04 23:36:00,3927,Marshmallows are available at every convenience store
255458,irishfield,2008-10-04 23:37:00,26272, 
