238205,walleyemen,2008-08-10 02:39:00,316,"Well the day started out great nice weather, steam out and set up rods, banged 3 fish pretty quick then the bite died down, but Bowen not easy to give up switch things around and we were back in business, lost count of how many fish, and yes i lost a nice one after 15 minute fight that was still out quite a ways, had one salon who hit a dipsy and thought he could out run the boat and almost did LOL, i think we had 2 or 3 double headers, great day to be out with some great people, Bowen runs a top notch business, he really knows his stuff, would like to thank Joe for the invite it is always a pleasure to get out and fish with him and little Joe, for anyone interested Bowen is top notch and will get you on fish, although he diid land the biggest fish of the day, geesh you would think these charter guyz would leave the big fish for the customers!!!LOL enjoy the pics!       Bowen with the big fish of the day!! "
238207,Sandbag,2008-08-10 02:46:00,533,Nice job out there WM...  Thanks for sharing..  Cheers  Craig
238220,Leecher,2008-08-10 03:51:00,7832,Great report and pics walleyemen  You guys sure had a busy outing  Thanks for sharing Leechman
238243,Stoty,2008-08-10 12:25:00,2910,"Going by the title.....I was waiting for a ""holy mack-i-naw"" in the report! "
238245,Smokey,2008-08-10 12:28:00,1278,"Some great fish there, Congrats."
238298,Guest Johnny Bass,2008-08-10 14:39:00,0,WOW! Sounds like a great day out on the water with some heart pounding excitement for sure! Thanks for sharing.
238454,walleyemen,2008-08-10 23:40:00,316,"Johny was heart pounding for sure!Man arm my arms sore today LOL!Those were just the fish we kept and a small one that wasn't going to make it, we released lots of smaller fish , was a blast for sure."
238459,highdrifter,2008-08-11 00:09:00,2534,HEY!!  That wee one looks like an Atlantic..  Oh the humanity.. Someone call fisheries and oceans!!  Nice Kings.  Well done!  cheers HD
