765852,Rod Caster,2013-02-07 00:15:00,5784,"Driving out to a spot wearing shoes, jogging pants and no toque, even at -20 is a fantastic thing. Only in the winter can I take 3 or 4 hours out of my day and easily get to some good fishing with VERY little effort. I love mid-season ice fishing... it can be as easy or challenging as I wish on any particular day.  Callander Bay (nipissing) provided some great fishing today. Fished 12-14fow, near a shallow bay, using a tiny buckshot spoon and a minnow head. I tallied 11 walleye, 4 big perch and finally, my first whitefish in a LONG time. Catching a whitefish has been a recent goal of mine, and even though I was not really targeting that species today, it was great to finally catch one. Here are the photos from Callander Bay:          Here is a video of JoeyTier catching a nice pike from Nipissing. My narration of ""that's a 15 pounder"" is NOT accurate haha. WARNING THERE IS ONE SWEAR WORD  http://www.youtube.com/watch?v=osLlY5aCuME&feature=youtu.be"
765854,mercman,2013-02-07 00:21:00,7054,"Awesome Chad !!! Just drive out, open the car door, drill, and reel em in   God its great to be Canadian"
765858,NAW,2013-02-07 00:48:00,4022,Awesome chad!  Looking forward to catching up this weekend!
765860,Joeytier,2013-02-07 00:54:00,3990,Man I want a whitie now
765862,Rod Caster,2013-02-07 00:57:00,5784,"I got two great looking filets off Mr.Whitie. Anybody have good suggestions for cooking whitefish? I was thinking of baking in butter with a some butter, dill and pepper...or something like that."
765869,spincast,2013-02-07 01:15:00,3279,Right on Chad - looks like a great day. Congrats on the whitie. If you want to ship a filet or two down here I have some recipes and can tell which one to use?
765870,Acountdeleted,2013-02-07 01:22:00,2562,A whitey in 14 fow? Man you just tell the fish to get up on the ice and they listen to you don't they?  Great job. Love the car fishing.
765874,Rod Caster,2013-02-07 01:37:00,5784,"Sure, I'll just pack them with ice and....Hey! wait a minute  I know, I didn't expect to catch a whitefish that's for sure. At first I thought I had a world record herring!"
765905,asdve23rveavwa,2013-02-07 03:15:00,2690,Great stuff Chad!! Must feel good to finally get out there again!
765946,Lip-ripper,2013-02-07 13:43:00,228,"Nicely done! it's been a fantastic year for Nipissing that's for sure. ""It's a 15 pounder!"" lol, I have a buddy that's doing that all the time  As for cooking the Whitie, I'm in the same dilemma. Got my first one in years and not sure what to do with it... I thought about baking it with spices and a cream cheese/crab meat covering but have heard that they are terrific fried. Did you find it was a bit of a mess to clean relative to other fish? I did and also mine had snails in its stomach."
765948,moxie,2013-02-07 13:45:00,1566,Good on you for getting out. Nice catch.
765949,ecmilley,2013-02-07 13:55:00,2163,"nicely done, going after whities myself friday"
765955,Leecher,2013-02-07 14:32:00,7832,"Awesome Chad    Got to love it when you can fish out of your vehicle     Congrats on the whitie    Bet you thought you had a 15lbs walleye on when that beauty hit your jigging spoon eh  Your having a great season so far   Keep it up      As for suggestions on cooking whities.... a dab of butter in a hot pan, salt & pepper to taste and that's it    That's how I cook my fish.... with a side dish of rice and thinly slice sautéed vegetables  Tight lines TJunkie"
765957,Rod Caster,2013-02-07 14:36:00,5784," You get yours on Nipissing as well? How deep?  I'll likely bake it with very basic spices, or I'll do a light breading and bake it.  I found it quite easy to clean but yes, it did make a bit of a mess, lots of slime and blood. The wife just found a huge blood stain on the top of the paper towel roll. Lets just say it didn't make her morning haha."
765969,Lip-ripper,2013-02-07 15:33:00,228,I got mine in 12 FOW in Nipissing in the middle of the day.  I was surprised but happy as it was a different species which is always welcome.
765973,mr blizzard,2013-02-07 15:52:00,1589,"Great catch, glad u had a terrific day  and most importantly delicious dinner. The whities are alot harder to catch up here than they were in Ontario.  After many recipies over the years we still 99 percent of the time do them up as follows.  If you have the time cut the fillets into nugget size pieces and put them in a zip lock, add your fish crisp, rocky, chronzy or combination, just enough to coat the fish and leave in the fridge for a couple of hours, if u do not have the time to put in the fridge no worries. Add 1/8 of an inch of olive oil in the frying pan, when the oil is just starting to show tiny pin size bubbles add the fish, turn over till golden brown. Taste like chicken."
765979,Nipfisher,2013-02-07 16:07:00,2449,Do Whitefish stink like Herring?
765993,Lip-ripper,2013-02-07 17:15:00,228,"Actually, I found it smelled like cucumbers."
765998,Rod Caster,2013-02-07 17:37:00,5784,Exactly my thoughts. For sure like cucumber
766103,Rod Caster,2013-02-08 00:42:00,5784,"Whitefish baked at 375 degrees with olive oil, pepper and lots of rosemary. Absolutely delicious!  "
766153,gino,2013-02-08 03:56:00,400,wow! awesome fish Chad!
