229148,misfish,2008-07-17 23:01:00,29133,Dont ask way Im on the Nitro site.  we surrender
229150,tibbs,2008-07-17 23:04:00,650,That's a great commercial!  LOL!
229156,jwl,2008-07-17 23:27:00,1056,"that's funny....I like a few of the older fishin commercials I can remeber. like the Ohenry one where the fish catch the people, or the one, I forget what it was endorsing but...there are a couple guys out fishing, one says to the other one..""if I take one more cast, I think my arm is going to fall off""...his buddy says..""awe come on you big baby""...so he winds up takes the cast and his arm goes flying off into the water, and they both stand there looking like this"
229159,Terry,2008-07-17 23:35:00,14456,yup  that is a good one
229160,danbo,2008-07-17 23:35:00,2646,Keep that up & you'll go blind!
229176,misfish,2008-07-18 00:23:00,29133," And in deep kaka if I bought one. But she,s not here right now,so I can look. No harm in that,just wish they would stop looking at my eyes."
229178,MCTFisher9120,2008-07-18 00:26:00,3761,"lol,i think i have seen that one on tv."
