974210,spincast,2016-06-19 20:55:00,3279,"When you lifted the tail off the floor, it was 18.4 - a PB for the G-man. We covered a lot of water while this dude took the stairs to the surface.     we had a mixed bag of cohos and bows today, but the bottom feeders were the pigs of the day. Blisters on the lads hands today.       the mudders went home, the cohos came home  Smoked coho next week,"
974211,leaf4,2016-06-19 21:00:00,2466,"Nice day, the girlfriends dad got a nice Sammy yesterday, decided it was too hot to head out today I bet he'll wish he did after seeing this lol"
974232,Freshtrax,2016-06-20 00:55:00,2215,"Nice going, I need to figure how to put more coho in the boat. They sure taste good."
974233,MJL,2016-06-20 00:57:00,2427,"Congrats to G on that fine catch. I'd imagine if you did want to try smoking one of those lakers, you could probably smoke those things forever and they'd never dry out. haha"
974235,Gallie,2016-06-20 01:07:00,1215,Sweet slobs!
974384,Tim Mills,2016-06-21 04:12:00,476,"good for you guys, well done"
974504,i2cool2fool,2016-06-22 03:22:00,349,Big fish but bigger G-Man. It's true. Kids grow up fast! Great memories created no doubt.
974512,spincast,2016-06-22 08:56:00,3279,"Ah, yeah. The last 12 months have been crazy in that department. And the kid eats like a Salmon - constantly."
