105199,Rich,2007-08-19 19:08:00,3927,"Greensot and I did a bit of a run to a few spots locally yesterday. It was a great day, fishing was alright. A few bass and some others caught and lots of good conversation. Really shows that you can have a great time and get into some good fish whether or not you have a boat.      Thanks for the great day Travis."
105340,Pigeontroller,2007-08-20 01:55:00,2793,"Nice Bass Rich, whats with takin' pics of Sunfish?"
105342,ccmtcanada,2007-08-20 01:57:00,7971, I'm pretty sure that sunfish is sucking on his thumb and that's why they took the pic...LOL.  Nice report Rich...glad to see you're getting out there quite a bit.
105349,Crazyhook,2007-08-20 02:42:00,1154,first fish is a beauty rich! the second... lol
105375,jediangler,2007-08-20 04:31:00,1923,"Don't listen to them Rich, that's a beauty sunfish."
105445,Rich,2007-08-20 15:25:00,3927,It's just a small step from WGSF....
