948184,jdm66,2015-12-06 10:29:00,7,"We have access to handguns and assault rifles.They are classed as restricted firearms,which you must take a firearms safety course,as well as a lengthy background check.There are no CCW permits up here,only LEO's and armored truck personel are allowed to carry.Restricted firearms must be trigger locked and kept in a locked case/ or gun safe at all times.You transport your locked cases to the range, have some fun, then they get transported back home.Our pistol magazines are restricted to 10 rounds max,all rifles 5 rounds max."
948186,spincast,2015-12-06 12:06:00,3279,"http://www.nytimes.com/2015/12/04/us/fear-in-the-air-americans-look-over-their-shoulders.html?mabReward=A7&moduleDetail=recommendations-0&action=click&contentCollection=Opinion&region=Footer&module=WhatsNext&version=WhatsNext&contentID=WhatsNext&src=recg&pgtype=article  I have stayed out of this one as I made my thoughts on this particular subject clear last time. However, the article above provides some interesting insights to the impact this gun toting mentality is having on a broad number of America's citizens.  Some on here won't change their opinion until their gun is pried from their cold dead hands. Charlton didn't recognize the irony inherent in that statement. Hopefully some can open their minds to an alternative position. Interesting comment from one of the readers of an article ...""Americans shoot other Americans... Canadians shoot with other Canadians""   but anyway just thought this was worth sharing."
948188,aplumma,2015-12-06 13:19:00,6896,"We have access to handguns and assault rifles.They are classed as restricted firearms,which you must take a firearms safety course,as well as a lengthy background check.There are no CCW permits up here,only LEO's and armored truck personel are allowed to carry.Restricted firearms must be trigger locked and kept in a locked case/ or gun safe at all times.You transport your locked cases to the range, have some fun, then they get transported back home.Our pistol magazines are restricted to 10 rounds max,all rifles 5 rounds max. Thanks for the info.  I did not know about the handgun assault rifle restrictions I though it was though shalt not have situation.  Art"
948189,aplumma,2015-12-06 13:31:00,6896," There's lots of stories of accidental shootings, like a 3 year old accidentally shooting mom. Not so many stories of armed citizens gunning down bad dudes or terrorists. The media does not report near as many accidents from other reasons such as a middle age child killed after falling off the monkey bars. The gun shooting is a story that sells while the kid who fell is just a accident. The amount of time where the situation presents itself to step up and be the hero and save the public guns a blazing is very rare compared to the number of other ways people die. I still contend that a gun is a tool that when cared for , put away and used properly it will rust into scrape before it does anything bad.  Humans  hurrumph  we are the plague on the earth lol  Art"
948203,OhioFisherman,2015-12-06 18:37:00,6623,http://www.wafb.com/story/30674236/dog-reportedly-shoots-toledo-pizza-delivery-man   Even our dogs are crazy?
948206,Rattletrap2,2015-12-06 19:28:00,1652,"I'm not so sure our gun laws are all that great. I agree with things the way we have it, but I'm not so smug to believe they are all that thorough with things like background checks and such. When i applied for my PAL a few years back, it dod take a few months, but none of my references were contacted....including my WIFE! I'm thinking that they should hve at least clled her to see if She was aware of my application!"
948215,TenInchJake,2015-12-06 21:55:00,21,Did your wife sign the form Rattletrap? That might indicate an acknowledgement on her part. I've had my spouse and my other references checked when getting my RPAL. I can't remember from when I just had a PAL. And you have a CPIC check done on you every single day when you have a firearms license. It's a continous eligiblity program.
947778,DRIFTER_016,2015-12-03 21:40:00,10439,"I think you can throw disgruntled employees out the window, 12,000 rounds of ammo and 12 pipe bombs in their residence.  Nope!!! They are blaming it on climate change!!!!"
947783,manitoubass2,2015-12-03 21:55:00,11391,And planned parenthood???
947787,irishfield,2015-12-03 21:59:00,26272,Wow... off to get the boat ready for Friday and Saturday.
947790,manitoubass2,2015-12-03 22:05:00,11391,Same here!!!
947791,aplumma,2015-12-03 22:05:00,6896,"I got a friend who has over 50 assault rifles with three of them 50 cal. with optics and way more than 20,000 rounds for them. It is a collection that would bring tears to your eyes from the mechanical art work and the rarity and stories behind them. It is something to look through the scope of the 50cal. sniper rifle and at 880 yards ( 1/2 mile) knowing it can hit a 6 inch gong if you are good enough. You will never convince me that a gun is evil it is the person behind it that makes the decision. I agree with all of the checks and tests to get a gun but if you qualify you should be able to get the gun you choose.  Art"
947794,SirCranksalot,2015-12-03 22:10:00,3291,"So it takes 4 months before you can get a firearm - doesn't do the lady much good who is afraid of her ex-boyfriend does it - when he comes back a week later and kills her - its a God given right to be able to defend yourself and your family without having to go through the wringer to get a firearm - I can go over to Cabela's - pick out a firearm - rifle or handgun - go over to a computer and enter certain information - wait about a half hour and then pick up the gun and go home - that's the way I like it -  In Canada all it takes is the government to require all persons to turn in their guns and that's the end of your ability to defend yourself with a gun - or hunt - that can't happen here - I like my right to bear arms - a armed citizenry is a free citizenry - remember that -   Whatever you say, Joe. I'm sure glad we don't have your screwed up system here in Canada!! Keep it to yourselves, willya? Do the world a favour!"
947797,manitoubass2,2015-12-03 22:14:00,11391,Thats awesome!  Ive had the priveledge of shooting some pretty awesome guns and it sure is a good time!
947798,woodenboater,2015-12-03 22:15:00,2277," In Canada all it takes is the government to require all persons to turn in their guns and that's the end of your ability to defend yourself with a gun - or hunt - that can't happen here - I like my right to bear arms - a armed citizenry is a free citizenry - remember that -  Will never happen. We don't fear our government like some militias in the states do. We may hate their policies etc but in general, we don't worry about them turning on its citizens. Same with England, Australia etc.. ymmv"
947803,aplumma,2015-12-03 22:43:00,6896,Thats awesome!  Ive had the priveledge of shooting some pretty awesome guns and it sure is a good time! I am very lucky to live where i do we have some really great places around here to see examples of mechanical engineering. Just 15 miles from my house is the museum of flight with the actual space shuttle and other technology for you to see and touch. I have over the years collected places/friends with machine shops from custom motorcycles to a shop (one of three) certified in submarine repair welding and f15 landing gear sleeves. To some the sight of a 3 inch x 30 inch sleeve of metal is not impressive until you find out it is less than a thousandth of an inch tolerance. A painting is nice but precision is a real work of art to me.  Art
947862,scuro2,2015-12-04 02:50:00,904,"So it takes 4 months before you can get a firearm - doesn't do the lady much good who is afraid of her ex-boyfriend does it - when he comes back a week later and kills her - its a God given right to be able to defend yourself and your family without having to go through the wringer to get a firearm - I can go over to Cabela's - pick out a firearm - rifle or handgun - go over to a computer and enter certain information - wait about a half hour and then pick up the gun and go home - that's the way I like it -  In Canada all it takes is the government to require all persons to turn in their guns and that's the end of your ability to defend yourself with a gun - or hunt - that can't happen here - I like my right to bear arms - a armed citizenry is a free citizenry - remember that -  Guns don't kill people, people kill people. Hmmm...must be something in the water down south."
947867,wkrp,2015-12-04 03:26:00,656,In Gun we trust. May God bless the NRA.
947871,manitoubass2,2015-12-04 03:35:00,11391,Better then trusting governance.  How many issues has that caused?
947884,ehg,2015-12-04 05:19:00,2666,In Gun we trust. May God bless the NRA. There has been 355 mass shootings in the U.S.A so far this year. Team gun culture.  https://www.washingtonpost.com/news/wonk/wp/2015/12/02/the-san-bernardino-mass-shooting-is-the-second-today-and-the-355th-this-year/ Better then trusting governance.  How many issues has that caused? Not near as many mass shootings in Canada. Mostly of aboriginal people in first couple hundred years. In last 100 years maybe a couple of dozen times in Canada.  https://en.wikipedia.org/wiki/List_of_massacres_in_Canada
947905,aplumma,2015-12-04 13:10:00,6896," Guns don't kill people, people kill people. Hmmm...must be something in the water down south. While simplistic it is a true statement. The first thing you have to deal with is the bad guys have guns and will not be the ones turning them in if they become illegal. Pandoras box is open you can not close the lid so what works for Canada will never work in the USA. Personally i am glad Canada does not have access to handguns or assault rifles your culture would become more violent and mirror the path our culture has taken. You meaning most people of Canadian culture will not understand the dynamics going on down here. I am good with that it is one of the things I like about Up North people who still have the ability to have hope for a gentler world to live in. Funny thing is if you read Pandoras box once the evil was released inside the box was a small nugget left behind and it was called Hope. I think that nugget can be called Canada too.  Art"
947912,glen,2015-12-04 13:30:00,2641,Bombs knives guns. Governments.  Terrorists.
947947,manitoubass2,2015-12-04 16:15:00,11391,Governance as a whole buddy.  Resposible for WAY MORE DEATHS than every possible thing combined
948068,scuro2,2015-12-05 03:32:00,904,"While simplistic it is a true statement. The first thing you have to deal with is the bad guys have guns and will not be the ones turning them in if they become illegal. Pandoras box is open you can not close the lid so what works for Canada will never work in the USA. Personally i am glad Canada does not have access to handguns or assault rifles your culture would become more violent and mirror the path our culture has taken. You meaning most people of Canadian culture will not understand the dynamics going on down here. I am good with that it is one of the things I like about Up North people who still have the ability to have hope for a gentler world to live in. Funny thing is if you read Pandoras box once the evil was released inside the box was a small nugget left behind and it was called Hope. I think that nugget can be called Canada too.  Art Our constitution stresses peace, order, and good governance. We don't hope, we do, within a certain unwritten code. Politeness first, and you see that even in the toughest looking guys. It's funny sometimes at a coffee shop as the bikers hold the door for you. Being a Dick first just doesn't work up here. Donald Trump wouldn't fly up here. That massive collective housing fraud wouldn't work up here like it did down south.  The group vrs the individual.  Americans have had cause to be fearful way back when but then it became a personality trait. You can't trust this and you can't trust them. Every man for himself with their weapons cache. Frankly it sounds nuts to me, at the first sign of real trouble you will all be shooting each other. I'd be moving to Canada if I were you...and we will take you. Your welcome."
948073,Gerritt,2015-12-05 06:23:00,6129,"Completely different cultures. You cannot compare apples to oranges.... Their 2nd amendment is entrained in their culture; Americans will defend their constitution. As we do ours.  I understand both sides..... But this us vs. them changes nothing. They are our best friend and allie.  Infact we depend on ""their"" guns and our combined friendship, a lot more then the depend on us.....  I hope these people did not die in vain however, would I like to see change? Sure.  Will it happen? Probably not.... But I also don't see the need to anger our greatest allie......  Their issues, thier problems...... Their gun defend us.  Apples and oranges."
948097,Whopper,2015-12-05 14:47:00,2174,Thanks for your post Gerritt
948115,OhioFisherman,2015-12-05 17:32:00,6623,"I may have missed them? But I don't recall Canadian politicians posting these sort of pictures?  http://mashable.com/2015/12/04/christmas-guns-michele-fiore/?utm_cid=mash-com-fb-main-link#7S3bxoyrOuqQ  The last couple of election cycles it seemed like most candidates here made sure they had a pic of them packing iron? For some reason it isn't happening as much now?  Sound bites, whip your supporters into a frenzy? both parties do it here, the methods vary."
948140,aplumma,2015-12-05 22:47:00,6896,"Our constitution stresses peace, order, and good governance. We don't hope, we do, within a certain unwritten code. Politeness first, and you see that even in the toughest looking guys. It's funny sometimes at a coffee shop as the bikers hold the door for you. Being a Dick first just doesn't work up here. Donald Trump wouldn't fly up here. That massive collective housing fraud wouldn't work up here like it did down south.  The group vrs the individual.  Americans have had cause to be fearful way back when but then it became a personality trait. You can't trust this and you can't trust them. Every man for himself with their weapons cache. Frankly it sounds nuts to me, at the first sign of real trouble you will all be shooting each other. I'd be moving to Canada if I were you...and we will take you. Your welcome. It is a mindset for sure and Canadian mindset is something I envy and I wish it would work down here. The difference is the USA was not given independence we fought for it and won. We then wrote the Constitution and gave citizens certain rights to prevent a government from becoming a sole controlling force. Now with this time and society changed and we added rights to it and we blended them into the current laws governing the people. You have to take with a grain of salt what you are fed as facts up North some of the views I have read are way out of bounds and are expressed by people who have not ever visited the United States. I have been to Canada quite a few times but I only get a small snapshot of what life up North is because i visit the same 4 or 5 places every time.The same goes for down here we have places where you can shoot your guns out back and 10 miles away you can't even shoot a BB gun. We have places where you will not find 10 guns per 1000 people and others where you will find collections of guns that would make the police look like they have nothing. I am not scared by guns I have been trained to use them in the Sea Bees as well as in civilian life. I have yet to have some one draw a gun on me after my time in the service so it is not the wild threat that some are lead to believe. I also know that a day in the public I will pass by at least 20 people who have a concealed weapon and it is comforting to me. Crime needs victims and if you do not know who is armed and who is not you will have less opportunistic crimes. The ability to bear arms is part of a checks and balance that we rely on to feel safe as well as preserve a delicate balance that is not part of Canadian culture. I can sum it up with a meme I saw in the past it was someone had written in wet concrete ""sorry for vandalizing your concrete"" it instantly popped into my mind somewhere up in Canada before I read the next line that said "" Canadian gang signs"" .  This is not bad it just showed me that mind sets of different cultures make us each look at things differently. When I am up North I get to fish and philosophy  with some really great minds and it is refreshing to get views that I am culturally blind too.  Art"
948163,ehg,2015-12-06 01:34:00,2666,Santa better be careful when going down Nevada assemblywoman Michele Fiore's chimney at Christmas. 
948169,chris.brock,2015-12-06 02:22:00,4053,". Crime needs victims and if you do not know who is armed and who is not you will have less opportunistic crimes. The ability to bear arms is part of a checks and balance that we rely on to feel safe as well as preserve a delicate balance that is not part of Canadian culture  Art  There's lots of stories of accidental shootings, like a 3 year old accidentally shooting mom. Not so many stories of armed citizens gunning down bad dudes or terrorists."
948177,TenInchJake,2015-12-06 04:25:00,21," There's lots of stories of accidental shootings, like a 3 year old accidentally shooting mom. Not so many stories of armed citizens gunning down bad dudes or terrorists. The mainstream media doesn't report much on stories that don't fit their narrative? I'm shocked. Defensive use may get local coverage, but it will almost never get national coverage. Google 'defensive gun use' and you'll see plenty of stories. There's 'lots of stories of accidental shootings'? People die all the time from all sorts of accidents. I'll bet none of them get reported anywhere near the rate that firearms accidents do. Wonder why?"
948182,scuro2,2015-12-06 06:28:00,904,"Completely different cultures. You cannot compare apples to oranges.... Their 2nd amendment is entrained in their culture; Americans will defend their constitution. As we do ours.  I understand both sides..... But this us vs. them changes nothing. They are our best friend and allie.  Infact we depend on ""their"" guns and our combined friendship, a lot more then the depend on us.....  I hope these people did not die in vain however, would I like to see change? Sure. Will it happen? Probably not.... But I also don't see the need to anger our greatest allie......  Their issues, thier problems...... Their gun defend us.  Apples and oranges. Not an us vrs them at all but more like lets talk because you can't wrap this up in a nice little package where it only impacts Americans and doesn't impact Mexico or Canada. To me it's more like talking to a close relative with a significant problem that everyone else sees but them."
947661,Dutch01,2015-12-03 05:29:00,1431,"That must have been SOME argument!  Seriously, so the guy snaps. But who would go back with him over a work dispute?!?!"
947662,manitoubass2,2015-12-03 05:51:00,11391,Ah you see it?  Any military training in the area days prior???
947664,dave524,2015-12-03 10:46:00,4508," He was turned and the woman was his handler is more like it. Seems we have to fear our own so to speak as much as new ones or so it seems, recruitment of long term residents and naturalized citizens seem to be the mode of operation in many cases.  "
947690,DRIFTER_016,2015-12-03 15:49:00,10439,"That must have been SOME argument!  Seriously, so the guy snaps. But who would go back with him over a work dispute?!?!  Exactly!! And who has all the garb and AR-15s waiting just incase?"
947691,DRIFTER_016,2015-12-03 15:56:00,10439,Confirmed Terrorist Attack!!!!  https://www.funker530.com/san-bernardino-shooters-confirmed-as-islamic-this-was-a-terrorist-attack/  
947696,JoePa,2015-12-03 16:21:00,179,Well let me just say this - these shootings are going to continue and people are going to need to be able to protect themselves - people need to arm themselves so that when a shooting like this occurs law bidding citizens can take down the wackos before they can kill more people -  Notice that these mass shootings all occur in places where citizens are discouraged  to carry concealed weapons - so called gun free zones - naturally if someone has the intention to kill others these are the places where they will go -  I carry a concealed weapon with me most of the time - always have one in my vehicles just in case - then depending where I am going I often strap a handgun to my belt under my jacket - more and more people are beginning to realize that self protection is a wise thing to do - some school districts are now allowing teachers and administrators to carry a weapon - it takes the cops too long before they can react to a shooting - by the time they get there many have been shot - interesting times for sure -
947698,manitoubass2,2015-12-03 16:32:00,11391,"Joepa,  Also notice these shooting occur in the timeframe of police/military running drills at or near the locations?"
947699,Headhunter,2015-12-03 16:35:00,5703,I saw on the news that a young child (2 or 3 years of age) accidentally shot his/her mother. Now if only the mother had had a gun..... HH
947704,DRIFTER_016,2015-12-03 17:20:00,10439,"HH, you can't blame the gun for shooting the mother. You can however blame the mother for not properly storing the firearm."
947706,Headhunter,2015-12-03 17:26:00,5703,"HH, you can't blame the gun for shooting the mother. You can however blame the mother for not properly storing the firearm. 100% agreed... and with that in mind, isn't it obvious that there are far too many people with them, who are completely unqualified to do so? If you don't have the ware with all to properly manage what's obvious, such as proper storage etc... then there is obviously something wrong with the system that allows those people access to firearms. HH"
947709,Dutch01,2015-12-03 17:30:00,1431,"What about the fact that the guns used in this massacre were legally purchased?  How is it that you can be on a ""no fly"" list, but still buy a gun in the USA? You're too dangerous to go on a plane, but by all means grab your AR-15 while it's hot. What could go wrong?  I'm all for gun ownership, but I'm also for some control. Canada (mostly) does it right in my opinion, and it shows in our rate of gun crime.  Fyi, I don't object to you carrying a gun. I would do so too, if it were legal here.  I do think that it's ironic you have a ""war on terror"" when you have mass shootings at a rate of one per day. Where's the ""war on domestic gun violence""?"
947710,Dutch01,2015-12-03 17:34:00,1431," And by government, I don't mean Obama. I think these things would already by in place if he had his way."
947711,manitoubass2,2015-12-03 17:37:00,11391,Yep im all for guns/gun rights too but courses should be mandatory.  A good fishing buddy from MN teaches the courses there and I believe its law to be trained to carry.
947715,DRIFTER_016,2015-12-03 17:45:00,10439,"100% agreed... and with that in mind, isn't it obvious that there are far too many people with them, who are completely unqualified to do so? If you don't have the ware with all to properly manage what's obvious, such as proper storage etc... then there is obviously something wrong with the system that allows those people access to firearms. HH  Exactly!!! In Canada before we can even think about purchasing a firearm we need to take a safety course. My course lasted for 6 weeks and was one night a week. Then there is written and practical tests to pass before you can apply for a license to even purchase/own a firearm. Then when you apply for your license (there are a couple of levels most often applied for unrestricted (long guns and shot guns) and restricted (handguns and other restricted firearms) you send in all the paper work and the RCMP runs a background check on you (takes weeks). Then if you are approved you get your license and are able to go into a gun shop and purchase a firearm. They take down all the info off the card when you purchase and after you pay for it you leave the shop. You have to renew your license every 5 years which helps weed out the undesirables (wife beaters, crooks) who have popped up. They are then denied a license because of their transgressions.  This keeps the majority of mental cases gun free. There are still illegal guns around but nothing like the States because down there the 2nd amendment says ""every body gets guns""!!! No training and lax background checks.  On black Friday the FBI got 185,000 checks to do. Tell me how they can manage to not make an error with numbers like that?  Our system may not be perfect but I do believe it is a lot better than the one in the US."
947719,Dutch01,2015-12-03 17:53:00,1431,I am 100% in agreement with you there.
947720,manitoubass2,2015-12-03 17:54:00,11391,It took about 4 months if I remember correctly to purchase firearms.  I also believe our system is much better in comparison
947722,DRIFTER_016,2015-12-03 17:56:00,10439,It took about 4 months if I remember correctly to purchase firearms.  I also believe our system is much better in comparison  I did my course 20 years ago. I do think it took several months before I had my card in hand.
