947724,Headhunter,2015-12-03 17:58:00,5703,"What about the fact that the guns used in this massacre were legally purchased?  How is it that you can be on a ""no fly"" list, but still buy a gun in the USA? You're too dangerous to go on a plane, but by all means grab your AR-15 while it's hot. What could go wrong?  I'm all for gun ownership, but I'm also for some control. Canada (mostly) does it right in my opinion, and it shows in our rate of gun crime. Fyi, I don't object to you carrying a gun. I would do so too, if it were legal here.  I do think that it's ironic you have a ""war on terror"" when you have mass shootings at a rate of one per day. Where's the ""war on domestic gun violence""? Well kids, say your good byes cause the world is going to come to an abrupt end, HH and Dutch actually agree on something!!!! LOL HH"
947725,Dutch01,2015-12-03 17:59:00,1431,Lol! I'm going to buy a lotto max ticket on the way home!
947746,John Bacon,2015-12-03 19:19:00,3277,Lol! I'm going to buy a lotto max ticket on the way home!  Be carefull; I read something on FaceBook today about the odds of dying on your way to pick up your prize is greater than the odds of winning in the first place.  I have no idea if it's true.
947747,Dutch01,2015-12-03 19:20:00,1431,I suspect it probably is!
947764,BillM,2015-12-03 20:43:00,17367, I did my course 20 years ago. I do think it took several months before I had my card in hand.  I did my course a few years ago and it was months before I had a valid PAL in hand to actually purchase ammo or a firearm.
947766,JoePa,2015-12-03 21:01:00,179,So it takes 4 months before you can get a firearm - doesn't do the lady much good who is afraid of her ex-boyfriend does it - when he comes back a week later and kills her - its a God given right to be able to defend yourself and your family without having to go through the wringer to get a firearm - I can go over to Cabela's - pick out a firearm - rifle or handgun - go over to a computer and enter certain information - wait about a half hour and then pick up the gun and go home - that's the way I like it -  In Canada all it takes is the government to require all persons to turn in their guns and that's the end of your ability to defend yourself with a gun - or hunt - that can't happen here - I like my right to bear arms - a armed citizenry is a free citizenry - remember that -
947770,leaf4,2015-12-03 21:10:00,2466,
947775,irishfield,2015-12-03 21:36:00,26272,"I think you can throw disgruntled employees out the window, 12,000 rounds of ammo and 12 pipe bombs in their residence."
947527,npt1,2015-12-02 19:47:00,220,"Another mass shooting in the USA, KTAL news says over 20 victims. OMG."
947529,manitoubass2,2015-12-02 19:57:00,11391,"Not good not good at all?  Let me guess, hes white, hates the government, he voted democratic and hes on SSRI's(anti depressive medication)  Never let a tragedy go to waste(commence gun grabbing)  In all seriousness, horrible tragedy.  Prayers and thoughts to all involved.  Senseless violence???"
947530,Dutch01,2015-12-02 20:04:00,1431,"You're probably right about SSRI's, but don't expect the news to tell you that. Can't risk a lawsuit from big pharma...."
947531,manitoubass2,2015-12-02 20:19:00,11391,Sadly it almost always arises
947532,Snowball,2015-12-02 20:23:00,167,Link to LIVE TV coverage:  http://www.nbcnews.com/news/us-news/authorities-respond-report-shooting-san-bernardino-california-n472976
947535,DRIFTER_016,2015-12-02 20:40:00,10439,Supposed to be up to 3 shooters. Probably ISIS.  ALOHA SNACKBAR!!!
947536,manitoubass2,2015-12-02 20:49:00,11391," I laughed at that, no lie.  Then I cringed at the thought of lives lost.  We live in strange times"
947546,DRIFTER_016,2015-12-02 21:28:00,10439,"Proof positive how desensitized we are as a whole.  I laughed at that, no lie.  Then I cringed at the thought of lives lost.  We live in strange times  If you take the world we live in too seriously you'll end up eating your gun. Of course it's terrible that people have been injured and killed especially @ this time of year but you can't let this type of thing rule your life.  There will be another incident next week though. And another the week after that.  This world is messed up."
947548,misfish,2015-12-02 21:39:00,29133," If you take the world we live in too seriously you'll end up eating your gun. Of course it's terrible that people have been injured and killed especially @ this time of year but you can't let this type of thing rule your life.  There will be another incident next week though. And another the week after that.  This world is messed up.  Yup, cant let fear rule."
947559,OhioFisherman,2015-12-02 22:26:00,6623,"http://ktla.com/2015/12/02/authorities-respond-to-20-victim-shooting-incident-in-san-bernardino-fire-dept/  They just had a news conference with the police, sheriff and fbi, 14 dead and 14 wounded."
947560,captpierre,2015-12-02 22:29:00,2521,"Use to think ""crazy Americans"". But happened in Sweden, Ottawa, Alberta Could be in our backyard some day."
947562,OhioFisherman,2015-12-02 22:34:00,6623,http://www.cleveland19.com/story/30616801/active-shooter-reported-at-planned-parenthood-in-colorado-springs  A few days ago it was this.
947563,DRIFTER_016,2015-12-02 22:36:00,10439,http://www.cleveland19.com/story/30616801/active-shooter-reported-at-planned-parenthood-in-colorado-springs  A few days ago it was this.  That was a whacked out nut job.  This sounds more like a terrorist attack. up to 3 armed men in tactical gear reportedly carrying AK-47s.
947564,SirCranksalot,2015-12-02 22:48:00,3291,"the obvious answer is buy more guns, right???"
947568,DRIFTER_016,2015-12-02 22:55:00,10439,Unconfirmed reports of one of the suspects names. Pretty sure he's not a white Christian.  https://twitter.com/WCBM680/status/672154342040936451/photo/1   
947570,leaf4,2015-12-02 22:58:00,2466,"I don't see what the idea behind attacking this facility is? Its a medical place that I'm sure serves a wide range of help to those that are disabled, but I did read it also has a large part devoted to those who have mild to severe autism"
947571,DRIFTER_016,2015-12-02 23:01:00,10439,"I don't see what the idea behind attacking this facility is? Its a medical place that I'm sure serves a wide range of help to those that are disabled, but I did read it also has a large part devoted to those who have mild to severe autism  The people that were attacked did not work there. They were renting the conference room for some event. No one has said who the group was that was using the room. Sounds like the group that rented the room was targeted."
947584,OhioFisherman,2015-12-02 23:44:00,6623,"Supposedly the group renting the conference room was a local government agency holding a Christmas party and awards ceremony.  There has been a shoot out about 2 miles away, a suv is involved and two people are down."
947585,Fisherman,2015-12-02 23:48:00,7201,"Until the the facts come to light, it's all speculation."
947612,tb4me,2015-12-03 01:30:00,3295,"Read an awesome tweet today.. If JJ Abrams just said no star wars till there is ""competent gun control"",  Americas nerds would undo all this mess by next comic-con...But all kidding aside, this is just silly. Its getting to the point where I dont even tune in anymore.."
947616,chris.brock,2015-12-03 01:47:00,4053,"TV news tonight said the US is averaging 1 mass shooting per day. They define a mass shooting as 4 or more dead including the gunman. There were 2 today, Ca and Ga.  What the hell?"
947633,DRIFTER_016,2015-12-03 03:09:00,10439,Two bad guys dead.  http://www.cnn.com/2015/12/02/us/san-bernardino-shooting/index.html?sr=fbcnni120315san-bernardino-shooting0146AMVODtopVideo&linkId=19257339
947637,fishing n autograph,2015-12-03 03:19:00,2540,"One male one female, the U.S. Media is calling it a terror attack"
947648,SirCranksalot,2015-12-03 03:58:00,3291,"the U.S. Media is calling it a terror attack  Must be true then, if the media says it is!!"
947653,DRIFTER_016,2015-12-03 04:30:00,10439,One of the dead bad guys is Farooq Saed. Seems he works for the place that was having the holiday party in the conference room. Got in an argument with someone there and left. He came back with two accomplices. A woman who was killed with Farooq and someone as yet un named.  http://www.nydailynews.com/news/national/suspect-involved-calif-massacre-identified-article-1.2453471
