463543,NAW,2010-05-06 14:53:00,4022,"A friend just e-mailed this to me.  I would be very suprised if it has not been posted here before, but thought I would post any ways.  Could you imagine if this happend to you!!!    "
463553,rylan,2010-05-06 15:04:00,134,thats not a bear-- thats a seal.
463555,Spiel,2010-05-06 15:05:00,9065," Yep, that's a seal.   "
463561,skeeter,2010-05-06 15:10:00,1907,it was posted on here about a week ago. but i still like watching it--lol  wonder why the edited out the 6 year old school girls screams followed by the immediate evacuation of the bowels sound? ~~~~~~~~~~  ~~~~~~~~~~~~~~~~
463566,The JAY,2010-05-06 15:16:00,239,"I saw this, thinking it was a bear as well. My wife was more than happy to point out the error of my ways."
463567,Joey,2010-05-06 15:16:00,9122,Well the seal just saw an opportunity  Just like this penguin did...  Smart Penguin  Joey
463571,troutologist,2010-05-06 15:18:00,951,Believe thats actually a sea lion
463582,NAW,2010-05-06 15:36:00,4022,"I was kind of thinking same thing, but wasn't sure.  Either way.  Crazy..  Sorry for posting something that was just posted a week ago.  I check this site a few times a day (except for weekends), and I don't remember seeing this before.."
463585,Dutchy,2010-05-06 15:43:00,416,I haven't seen that before. Pretty cool actually.
