4780826,iman63,2016-04-27 20:04:00,91,Anyone have info on Sturgeon Lake ice.
4781106,roscoe33,2016-04-27 22:41:00,653,Satellite photos show it breaking up some. Should be open in less than a week. Temps in the mid 50's for Ignace for the next week.
4800274,iman63,2016-05-03 16:07:00,91,ttt
4800586,Skywagon,2016-05-03 17:36:00,1106,"I flew off our lake yesterday (walleye lake), there was still some areas of ice on the trout lakes, but would guess after the wind we had today, most of the lakes will be open. Sturgeon should be out shortly also."
4807426,Catman59,2016-05-05 14:33:00,345,Open from White Sands to Maries Bay ............... no ice in sight
4811730,iman63,2016-05-06 20:51:00,91,Thanks everyone for the information. 2 more weeks!!!!
