427515,Lunatic,2010-01-30 08:31:00,536,cant say that i have......but it's now been done  
427528,azebra,2010-01-30 12:46:00,168,AAHHAHAA thats awesome!! is that the Toronto location? is that real? haha think those kids got arrested?or fined?
427532,bigugli,2010-01-30 13:09:00,6138,It's been done a few times in U.S. stores.
427556,Fisherman,2010-01-30 14:32:00,7201,"Ya, and they're allowed to vote and breed."
427614,lookinforwalleye,2010-01-30 16:46:00,4399,Yup there is our future! excuse me while I weep!!!
427882,LeXXington,2010-01-31 15:48:00,1928,"LOL, maybe not jump in but if ever given the chance I heard the pond is a great place to go fishing"
427970,Stern Rules,2010-01-31 19:39:00,342,It never ceases to amaze me what idiots will do.
