3390690,a3dad,2014-12-24 07:01:00,115,"Does anyone know the Quebec 2015 season open dates for walleye and pike? Planning my trip for mid-may. http://www.mffp.gouv.qc.ca/english/p...ng-periods.asp didn't have 2015 listed yet. Thanks, Kevin"
3390866,Dore,2014-12-24 07:44:00,43,I tried the link & it worked. What zone are you fishing in?
3391962,Freytown,2014-12-24 14:51:00,770,"2015 start dates not listed yet.a3dad, use last year as a guide for 2015 or contact them. To be exact, I'd get the info from them."
3394818,a3dad,2014-12-26 07:21:00,115,Thanks guys. I'm fishing in zone 14 (the gouin).
3395050,retire55,2014-12-26 08:11:00,1029,"I believe the Quebec walleye season typically opens on the third Friday in May. In years past, I've been unable to get exact information via telephone or email until late March. However, perhaps I just don't know the right person to contact."
3410730,bftiger,2014-12-31 22:01:00,21,For Zone 14 it will be Friday May 15.
3421618,Gidyup2,2015-01-05 13:37:00,1,Is 22 South starting May 31st?
