406800,spinnerbaitking,2009-11-30 00:46:00,1622,"After Dad lost about a 4 lber, he caught 3 to My None, but then I crept  back to a 5 to 4 lead,  not that anyone was keeping track, accept him. Dad got the biggest just over 20"" nice way to end the season, one of the better day's he had this fall, water was 42.5 degrees, caught on tubes again in 7.5' to 10' of water, fished from 12:30 til 4:30pm   "
406807,Whitespinnerbait,2009-11-30 00:55:00,2038,Love the colour of those Green backs  Nice fishing Guys
406814,Leecher,2009-11-30 01:04:00,7832,Awesome way to end the season Richard Congrats to both of you Thanks for sharing Leechman
406826,Radnine,2009-11-30 01:19:00,1538,"I know that I have not been a member here for long, but I don't remember so many brilliant smallie reports especially this late. Nice job!! Jim"
406915,splashhopper,2009-11-30 03:28:00,2931,"we got skunked down here today.... tried fishing the tubes real sloooooww.... and then slower... tried dragging  a texas rigged senko.. slooooowwwww... naddaa...  oh well.. I have an early day tomorrow,,, gonna fish the last day of the season in the rain and snow I just want ONE more largie.... not that my NICKEL there last week was a bad way to end the season for me"
406921,tibbs,2009-11-30 03:36:00,650,Looks like a great day to finish off the season
407173,msp,2009-12-01 01:10:00,1336,Bass till the bitter end....gotta love it. November bass this year was great for me as well. I had the best two days of bass fishing of my life this November. I will post the pics for everybody when I get all the pics from my buddys camara. Here is one of many November largies   .
407176,spinnerbaitking,2009-12-01 01:35:00,1622,"Sweet looking largie, what you catch it on Richard"
