364777,BITEME,2009-07-21 19:02:00,1968,thats it kiddies see you in a week im headed to Nova Scotia to see my Granny Peace Out BiteMe
364778,TC1OZ,2009-07-21 19:05:00,987,Lets see some pics when you get back!
364779,fishnsled,2009-07-21 19:13:00,3520,Have a safe trip!
364780,Leecher,2009-07-21 19:14:00,7832,Have a great time Peter For some reason I see lobster or crab popping on your menu while you're down there LOL Leechman
364783,irishfield,2009-07-21 19:31:00,26272,Have FUN Peter !!
364832,castgame,2009-07-21 22:35:00,161,don't miss the mackerel run
364837,bigugli,2009-07-21 22:59:00,6138,Mackerel run nothing. That's just bait. Get out on a tuna boat
