1182272,MikeMcC,2010-03-26 07:53:00,72,"Just booked our trip to Red Lake August 7-14 at Howey Bay. Being this is our first time to Red Lake I was thinking about hiring a Guide for a day. Is it a good idea? Any suggestions on a Guide? Thanks, Mike"
1182496,Pooch,2010-03-26 15:58:00,4619,"There are a number of fellows on this board who are familiar with Red Lake and the Gull Rock area. Surely some of them are guides. If you have no luck, email me. I have a retired friend living in Red Lake who may be able to help you locate someone.Pooch"
1182539,Golden Eagle,2010-03-26 17:53:00,2642,Invite Bev Chaney to fish with you a couple of days. He knows the lake as well as anyone. Or he could put you onto somebody.
1182578,SoulFulCry,2010-03-26 19:36:00,158,id be very happy to take ya out on red lake for the day i live n fish red lake all yr long as much as i can u can reach me through red lake marine n ask for donny aiken or ya can call me at home and we could make arrangements for something im sure # is 1 807 662 4514 hope this helps n if ya get some one else then best of luck to u n hope ur fishin is awesome
1182605,Golden Eagle,2010-03-26 20:48:00,2642,Contact SoulFulCry. No way he can be as grouchy as Bev.
1182690,MikeMcC,2010-03-27 07:20:00,72,"SoulFulCry, thanks for your offer. I will contact you directly to set up the arrangements."
1182771,SoulFulCry,2010-03-27 12:30:00,158,no lol i am no wheres near as crabby as bev lol i have knowin him all my life and ur very welcome u can contact me at any time n we will set something up for u the lake is huge so if u want a specific area u would like to explore or try to do as much in one day as possible then ill do what i can ok again thxx for the offfer i look forward to seein ya in august
