319633,trophypikehunter,2009-03-20 18:01:00,89,Happy first day of spring everybody!!
319636,muskeybugged,2009-03-20 18:05:00,282,Well done ... good commentary!
319641,Guest ThisPlaceSucks,2009-03-20 18:15:00,0,nice gator bud. were you lookin around in the vid to make sure nobody was watching when you pulled it up? hahaha
319675,ozaibak1,2009-03-20 19:32:00,401,"Wow, great vid. Nice camera position and angle with respect to the sun, and nice pike as well thats a sweet size."
319679,Joeytier,2009-03-20 19:41:00,3990,Beautiful fish.  I'd love to get up there once more before the ice is gone.
319745,Leecher,2009-03-20 22:27:00,7832,"Great report and video trophypikehunter  The ice where you shot this vid looks the same as the local lake my daughter and I were today.  Still a good 16"" of ice left.  Beautiful gator!!! Good job and congratulations  Thanks for sharing Leechman"
