416844,Skud,2009-12-30 19:05:00,739,Well it could have been but I might have ate the first one.  Caught this when I was out with TEP on Monday in Cook's Bay.    
416848,blaque,2009-12-30 19:10:00,2419,veddy veddy eentelesting
416860,irishfield,2009-12-30 19:32:00,26272,Looks like someone missed a spot with the Rapala sissors.....oh ya there's no slot size for perch!
416866,Terry,2009-12-30 20:03:00,14456, LOL   never hurts to have a little extra piece of tail
416867,BillM,2009-12-30 20:04:00,17367,"Uh oh, the perch have been cross breeding with all the beta's that are dropped into Kempenfelt Bay"
416908,douG,2009-12-30 22:18:00,2693,"Skud, please pass along best fishes to Mr. Christensen,  whatever the heck his name is .  I dunno.  TEP is a cool dood."
416916,vinnimon,2009-12-30 22:38:00,2593,
417373,TEP,2010-01-01 01:09:00,68,You know douG........ I do have internet access. I can see what you have been up to....  Happy New Year!
417501,Stern Rules,2010-01-01 06:11:00,342,I second that!
