553624,Court R,2011-02-20 14:47:00,213,Looked through the regs and didn't see anything on limits.
553626,Sinker,2011-02-20 14:49:00,8692,"No limit, open all year.  S."
553627,Roy,2011-02-20 14:50:00,13728,"I'll check but as far as I know, there are no limits on ling. I'll get back to you."
553628,Roy,2011-02-20 14:54:00,13728,The regs make no mention of ling limits. Geeez am I ever slow.
553633,Court R,2011-02-20 15:08:00,213,"Awesome,thanks for the help."
553809,Fisherman,2011-02-20 23:45:00,7201,"If I'm not mistaken they fall into the ""coarse"" fish category, read more grasshopper and your questions will be answered. But, by then you'll probably have forgotten what you were wondering about.  From the regs:Coarse fish include: gar family, bowfin, catfish family, burbot, eel and freshwater drum or sheepshead.  Burbot a.k.a. Ling"
553830,dave524,2011-02-21 00:31:00,4508, Aren't eels an endangered species now or a species of concern and have a protected status?
553857,Fisherman,2011-02-21 01:19:00,7201,"Yes, you're right."
