1057955,lew,2020-03-25 12:20:00,12766,Always have plenty of gobblers in the yard and it's interesting to watch them looking for a friendly lady.   
1057965,irishfield,2020-03-25 13:12:00,26272,"Another few weeks of lock down and he's gonna look good in the oven! My ""group of 7"" that go by the shop door every day might just become the ""group of 6"" soon..."
1057967,crappieperchhunter,2020-03-25 13:15:00,2582,Saw one putting on a show for 5 ladies coming home from ice fishing yesterday. Would love to have been close enough to get some photos like you do. Thx for sharing. 
1058017,Rizzo,2020-03-25 21:59:00,4754,"oh wow, by the title I thought you had just hit the gym and were headed home to the missus...😬"
1058024,Fisherman,2020-03-25 22:27:00,7201,"You weren't the only one, Lew is getting a bit raunchy, lol."
1058030,lew,2020-03-25 22:43:00,12766,My raunchy days are far behind me  LOL
1058032,SirCranksalot,2020-03-25 22:59:00,3291,Those mallards on the river are looking better every day!!
