1311557,v-bay gord,2011-05-26 12:10:00,3168,......and the law that refuses entry to fishermen wanting to come to Canada because they may have two minor criminal charges makes any more sense?
1311594,JinxCanada,2011-05-26 14:05:00,1306,A criminal is a criminal. so yes
1311596,Guest,2011-05-26 14:10:00,0,Depends on who's getting screwed huh Jinx LOL
1311605,tv4fish,2011-05-26 14:26:00,2694,"Q. What if I don’t live in Canada, but boat there? A. Non-residents only need to obtain a Pleasure Craft Operator Card if they are operating their powered boats in Canadian waters for more than 45 consecutive days or if the boat they are operating is registered or licensed in Canada (this includes rented boats). Boater Education Cards or equivalent certifications are recognized in Canada. Proper identification should be kept on board at all times to provide proof of residency. Q. What if I rent a powerboat or PWC?A. Currently, a Pleasure Craft Operator Card is not required in order to operate a rented watercraft. Instead, it is sufficient for a renter to complete a rental safety checklist. Take note however that some companies have made it their corporate policy to require renters to have their Pleasure Craft Operator CardHUH --- I'm sorry - this rule/law makes no sense to me -- It sounds like they're trying to have safe boaters running boats - they think I know how to run my boat safely for 44 days, but one day more and I have to be ""trained"" to be safe !! !(I know, I know - they HAVE to draw the line somewhere)OR - If I rent a boat they assume I know how to properly operate a boat (even though I may NEVER have run one before) and therefore don't need any safety training."
1311732,JinxCanada,2011-05-26 20:08:00,1306,"There's no comparison to Canadians getting screwed with this rediculous law. If anything FOREIGNERS (ie/ Americans) should need a licence before we do. Instead, we give them cart blanche to do whatever they want while WE are expected to follow the rules? Give me a break. Plus, I'm sorry but the relality is if you are a convicted criminal why the **** would we want you here??? The same rule applies for Canadians trying to enter the USA btw. I don't hear you complaining about that now do I?"
1311759,v-bay gord,2011-05-26 21:14:00,3168,"O.K.......my first impression is correct. Your attitude to those south of us....or as you would refer to them, as FOREIGNERS, seems apparent to me. I am a proud Canadian and can rant and rave about the folks to the south with the best of them........but I am not given the mission to refuse them entry, or otherwise harass them at the border. Sorry, but I don't buy the arguement that someone with two dui's is a criminal that deserves to be refused entry to this country. Your attitude is what needs to be reviewed. Why you are on a website that is all about U.S. citizens coming to Canada to fish is beyond me. The process at our border for many U.S. citizens wanting to fish in Canada is totally stupid.....if you agree with the extra ""punishment"" we seem to want to dish out, then you need to ask yourself what you are really accomplishing at the border. So far I have not seen the ""crime wave of minor criminality Americans running amok in Ontario"" dimish. But what I have seen is business's in the NW suffer from the stupidity.......so, while I don't agree with the boating regs, and could possibly agree with your position, coming from you I find your arguement somewhat irritating .........."
1311773,Moondog,2011-05-26 22:00:00,362,"I am now in Canada but not before another great border encounter. Coming back in to the USA we get ""profiled"" because we have a camper with a refrigerator so therefore we are smuggling 3rd world country citrus into the United States via camper. Oh yeah........Canada gets a lot of lemons from Afghanistan. Last year I asked the ""agricultural specialist"" if her time wouldn't be better spent looking in my underwear for C4, but then I digress. We have been coming to Canada to fish since??? They know who we are, they have already done a background check on us umpteen times yet we were searched entering Canada as usual. We refer to this as our annual ransacking. This time the officers were obviously interesting in just looking at our new motor home. So nothing is new...........we just plan to be at both borders an hour while people look for something they know we don't have. come on."
1311777,NWwalleye,2011-05-26 22:08:00,223,"Gord,I don't total agree with you on the BS and harassment that non residents are getting at the border .. Yes, it might hurt local business in the area .. I think that strip searching a vehicle looking for oranges is not needed. Rightfully wrong by the Boarder crossing official .. This person needs to remember what the purpose of their job is. But we must remember, that all the checks are necessary to insure that the hard core criminal or illegal substances don't get onto Canadian soil. Someone with 2 DUI's / DWI's is not a hard core criminal, as we think.. But, he is a repeat offender !!! And a Criminal by the Canadian Criminal Code ... Right or Wrong ???? Who is to say that he doesn't have few too many in Canada, let's say in Vermilion Bay (remember he is on a vacation).. He drives down the road and takes out someone you know . Would our attitude change towards letting a repeat offender into V. Bay .. Yes it would, I think ..The person with a insignificant crime, that happened many, many years ago.. Should have the knowledge by now, that they will be turned around at the border..It is common knowledge by all that read newspapers , watch TV or are part of a fishing forum .. THE WORD IS OUT !!!They should / could have taken the steps needed to be granted a pardon and permission into Canada, prior to the annual trip to Canada . https://www.walleyecentral.com/forums...ad.php?t=76838I would have to do the same, if I had done a crime, that the US Government / Homeland Security classified as a non allowable offense .I am sure of that ..Just my thought ... This thread originally was started about the boaters card .. So here is my 2 cents about that .. Hey Guy's and Gals. Canadians have had to either challenge the Boaters exam or take the Boater course, then write the test, at cost out of our pockets .. I don't think that you will get much sympathy from Canadian residents, when all you have to do is take 5 minute check list ( at NO COST ) and BAM, you are authorized to drive a boat on Canadian waters .. I drive my boat and Lodge boats on local water at least 70 days a summer, I consider myself very proficient at boat handling.. I need to be, as I guide for many Lodges in the area ..I had to take a Test and get a Boater Cards. Is it fair for the non-resident to do a 5 minute check list (not a 2 day course + Test), that only drives a boat 5 - 7 days a year on their annual Canada fishing Trip, can be considered competent to handle a boat on Canadian water.. Sound fair to you , I THINK NOT !!!"
1311965,JinxCanada,2011-05-27 14:13:00,1306,I agree this is about the boaters card...and it's rediculous. as for the DUI stuff and other criminality...this is not a new law. This law has been in place forever and has been enforced forever and is not about to change. The same rules apply to Canadians trying to go to the USA. Criminals are not wanted. The sad thing is the cavalier attitude most (yes Americans) have towards drinking and driving. It's still consider a nothing offence which blows my mind. I think this probably relates to the American attitude in general (sorry to offend) that they can do whatever they want whenever they want where ever they want. You have no right to come to Canada...as I have no right to go to the USA. If you don't like or respect our laws as a sovereign nation then I suggest fishing trips to Italy or somewhere else.
1313540,cast_and_blast,2011-06-01 14:49:00,1098,"I was just at Rainy Lake and we stopped at the duty free before we crossed. Outside was a guy sitting with his suitcase. I wandered out and chatted with him and he had been turned back at the border and his buddies had proceeded (with his truck!) and he was waiting for cab to take him wherever he was going to catch a ride home. He was bummed out, but said he didn't know anything about the law regarding DUI's and crossing the border. From our conversation it sounded like it was 3 or 4 years old. Tough lesson. Scott"
1313736,JinxCanada,2011-06-02 05:21:00,1306,"statistics can be made to show anything man. it's easy. a percentage is not the same as the number of cases or the number of arrests/convinctions. Where's your stats on that? The number of US Fatalities according to your statistics is 10 TIMES the number of that in Canada. Yes we have a much smaller population and as such the percentage is slightly higher, but that means nothing. And I never said it wasn't a problem here either. However....we as Canadians OBVIOUSLY take it more seriously as a culture since it is a FEDERAL CRIMINAL OFFENCE here....and often just a slap on the wrist in the USA. Care to comment on that one? First offence here can land you 5 years in Prison. check all your facts.As I have no time to read it I'm curious why you didn't also include the same information about the USA statistics such as amount of money lost to property damage etc there? I'm betting it's HUGE...and the percentage of deaths etc of minors in the USA. Feel free to add to your post. See how easily statistics can be used to show almost anyone's point of view? Compare apples to apples please. ALSO...please don't try to start telling me Canada has the same type of DRUG problem as the USA does. You are the worlds NUMBER ONE CONSUMER of Illegal Narcotics. Just another fact :-Pand...I also feel that if you're a criminal here in Canada then you have no right to enter the USA either."
1313790,Obabikon,2011-06-02 07:25:00,2370,"Jinx, Maybe it's just small town police, but I know a TON of people in towns close to me who have been pulled over (drunk). And either had their keys taken away from them, or were followed home. NOT having been given a ticket. In the states, I know one person who got out of a DUI and that was after going to court. The serious of the crime in Canada, makes the OPP give out fewer. I""m 100% sure of this. There is definately a drinking and driving PROBLEM in both countries, by both of it's ctizens."
1313815,J-Man,2011-06-02 07:53:00,191,"Does anyone have any stats on the average sentences for those convicted of driving under the influence? Particularly first time offenders?The maximum penalties for most offences are a joke. We did an exercise to study sentencing in high school in 1995 that would have made your head spin. Actual sentences for major convictions were pathetic and that hasnt changed as past history is the guide used for sentences. Many tougher sentences applied are rdecuded considerably an appeal to provincial supreme courts as they are outside the usual trends. Conditional sentences (available for any ""non-violent"" crime when seteneces are less than 2 years) are often used, which keeps people out of jail completely. When you add in almost guaranteed full parole at 1/3 time served and likely day parole after 1/6 time served, very little time is actually spent in jail on some of these offences with serious maximum penalties.I'm all for having serious consequences for many offences, but don't use a maxium penalty as evidence that we in Canada are tough on certain offences. That type of arguement will likely leave us looking a bit hypocritical. The ""minor criminality"" issue that has been a plague to the tourism industry in the last many years is a result of the classification of offences with these harsh maximum penalties that are rarely, if ever, doled out. It seems to appear that potential visitors to Canada are being held to a much higher standard than our own citizens in terms of how an offence if viewed. This is what can/should be addressed. Many of these offences could be downgraded in classification from indictable (felony) to at least hybrid (either/or depending on the facts), if not summary conviction (misdemeanor) if stats can show that severe penalties are almost non-existant for many criminal convictions. Especally when celebrities with colourful criminal pasts come enter the country freely to make public appearances, put on concerts and book speaking engagements. It's time for the double standard to stop, but there is very little political will/upside for this kind of issue so it will likely remain an albatross for many business operators for years to come."
1313816,jswinter40,2011-06-02 07:54:00,127,"i am sure the patrols and drunk driving sting operations in Sioux Lookout and Ear Falls are just intense! Give me a break dude. Its not even a comparison with the level of inforcement that the States now employ. Not to mention the sure number of officers the US employs as compared to Canada. (at least NW Ontario that I have witnessed). you have no idea how easy it is to get the DUI in the US. 0.08 is a very small amount. so basically you can not have any alcohol while out with your spouse for dinner and drive back home. it has really come to that.Your are right Jinxy, US Citizens love drunks and drugs. yep, life in the US is just one big TV episode. get off your high horse dude, people in the US take Drunk driving every bit as serious as Canandians. maybe not you, but I don't buy the general public has a greater concern because the concern is very high."
1313925,cast_and_blast,2011-06-02 11:57:00,1098,"Yep, I agree. These are taken from the MADD Canada site, not made up by me.Quote: Originally Posted by JinxCanada a percentage is not the same as the number of cases or the number of arrests/convinctions. Where's your stats on that?Again, these aren't my stats - these are from your folks in Canada.Quote: Originally Posted by JinxCanadaThe number of US Fatalities according to your statistics is 10 TIMES the number of that in Canada. Yes we have a much smaller population and as such the percentage is slightly higher, but that means nothing. And I never said it wasn't a problem here either. However....Well, that makes sense since the US has roughly 10 times the population of Canada.Quote: Originally Posted by JinxCanadawe as Canadians OBVIOUSLY take it more seriously as a culture since it is a FEDERAL CRIMINAL OFFENCE here....and often just a slap on the wrist in the USA. Care to comment on that one? First offence here can land you 5 years in Prison. check all your facts.Perhaps the max penalties for a first offense are more strict, but how often are those applied? And again, these aren't my facts - these are from your folks in Canada.Quote: Originally Posted by JinxCanadaAs I have no time to read it I'm curious why you didn't also include the same information about the USA statistics such as amount of money lost to property damage etc there? I'm betting it's HUGE...and the percentage of deaths etc of minors in the USA. Feel free to add to your post.Ah, if you had actually READ it, you'd see that I simply cut/paste the information as it stood in the document. For whatever reason, the MADD Canada folks chose to enter it in that way.Quote: Originally Posted by JinxCanadaALSO...please don't try to start telling me Canada has the same type of DRUG problem as the USA does. You are the worlds NUMBER ONE CONSUMER of Illegal Narcotics. Just another fact :-PUmm, I don't think I did try telling you anything about drugs. However, there is a huge article in a recent ESPN Magazine about US Customs targeting large hockey bags coming in from Canada as they are often used to import said narcotics. The whole point here is that you annoy people with your ""high horse"" attitude about ""Americans cavalier attitude towards drinking and driving"". Then, you get all bent when presented with the facts that disprove your statements provided by...wait for it...your own countrymen! Scott"
1313947,v-bay gord,2011-06-02 12:47:00,3168,"The only difference between the guy refused entry at the Fort Francis border crossing for having 2 dui's and virtually everyone else , is that the rest of us didn't get caught. My apologies to those saints, and non-drinkers in the crowd.....in which case pick from a list of other minor criminal charges that you were lucky enough to get away with. If none of the above applies, then congratulations on living a straight life, and making no mistakes.... To stay on topic, I will once again say I am dubious on the effectiveness of the boater safety card....but perhaps it is better than nothing. About as equally effective as a dockside boater safety checklist."
1313974,campchick,2011-06-02 14:23:00,96,A few years ago one of my staff members arrived at camp very pleased with herself because she had a boater safety card. I wanted to show her the lake one night after chores were done so I told her she was in charge of the boat and motor. She sheepishly confessed she didn't know how to start or run the outboard motor! And she didn't!! Tell me how this makes any sense at all?
1312007,v-bay gord,2011-05-27 17:37:00,3168,Most border officials are great......others might be viewed as offensive......
1312069,NWwalleye,2011-05-27 21:48:00,223,duplicate sorry ;-)
1312070,NWwalleye,2011-05-27 21:50:00,223,"Gord,That, I TOTALLY agree on . Both sides of the border .."
1312161,NWwalleye,2011-05-28 09:12:00,223,"Hope this will help someone ..I feel like we are on this one ...Sorry for the CAPS, I copied this from another site .. Wasn't me yelling at you..--------------------------------------------------------------------------------------------------------AN EXCELLENT SITE WITH BASIC EASY TO UNDERSTAND INFO ON ALL ASPECTS OF PREPARATION FOR YOUR TRIP TO CANADA FROM WHAT YOU CAN BRING TO WEATHER AND EVERYTHING IN BETWEEN INCLUDING INFO ON PERMITS IF NEEDED;WWW.INFONORTH.NETWWW.TRIPADVISOR.COMUPDATE ON DWI,CRIMINAL CONVICTIONS AND NON RESIDENT ENTRY INTO CANADAAS THIS SEEMS TO BE A MAJOR TOPIC SINCE 9/11 AND THE SUBSEQUENT INCREASE OF CHECKS ON CRIMINAL CONVICTIONS AT THE BORDER HERE'S THE SKINNY ON IT:ON JUNE 28 BILL C11 CHANGED THE RULES REGARDING NON RESIDENTS ENTERING CANADA WITH MINOR CONVICTIONS INCLUDING DWI'S IN THEIR PAST.AS IT STANDS NOW A PERSON ENTERING WITH A MINOR CONVICTION ON THEIR RECORD (NO MATTER HOW LONG AGO) MUST BE REHABILITATED OR APPLY FOR A TEMPORARY 30 DAY PERMIT TO ENTER CANADA.IF THE OFFENSE IS MORE THAN 5 YEARS OLD REHABILITATION CAN BE HANDLED IN ADVANCE THROUGH THE CANADIAN IMMIGRATION OFFICES AT EITHER FT FRANCIS OR THUNDER BAY.IF THE OFFENSE IS LESS THAN 5 YEARS OLD OR IF THE OFFENSE IS MORE THAN 5 YEARS OLD AND THE TIME REQUIREMENTS DO NOT ALLOW FOR THE REHABILITATION PROCESS BEFORE YOUR TRIP THERE IS A 30 DAY PASS CALLED A DISCRETIONARY ENTRY PERMIT THAT CAN ONLY BE HANDLED AT THE PORT OF ENTRY AND CANNOT BE PROCESSED IN ADVANCE.IT IS HIGHLY RECOMMENDED THAT THESE GUESTS CALL THE IMMIGRATION OFFICE IN ADVANCE TO GET AN INDICATION AS TO THE LIKELIHOOD OF THEIR ADMITTANCE. BOTH THESE OPTIONS HAVE A PROCESS FEE OF $ 200.00 CDN . AFTER JUNE 28 IF THE OFFENSE IS OLDER THAN 10 YEARS OLD YOU ARE CONSIDERED REHABILITATED.IF THE OFFENSE IS BETWEEN 5 AND 10 YEARS OLD YOU CAN BE GRANTED TEMPORARY VISITOR STATUS OBTAINING THE FORMS AND FILLING THEM OUT ALONG WITH A 200$ CANADIAN PERMIT FEE.IF THE OFFENSE IS LESS THAN 5 YEARS OLD YOU WOULD HAVE A VERY GOOD CHANCE OF ENTERING IF YOU CALLED AHEAD,HAVE RESERVATIONS IN CANADA,AND HAVE ONLY ONE CONVICTION LESS THAN 5 YEARS OLD.THERE IS THE 200.00 CANADIAN$ PROCESS FEE IN THIS SITUATION.PLEASE USE GOOD JUDGEMENT,HONESTY, AND MANNERS IN YOUR INTERACTION WITH IMMIGRATION OFFICIALS AND YOUR CHANCES WILL BE GREATLY ENHANCED.FOR MORE INFO CONTACT IMMIGRATION AT FT FRANCIS 807-274-3818 AND THEIR HOURS ARE FROM 8 AM TO MIDNIGHT."
1313012,tv4fish,2011-05-31 11:27:00,2694,"Gord: FWIW: It might do ALL of Canada (especially the ""law makers"")some good if they read your post.Thanks for having the guts to post that."
1313022,v-bay gord,2011-05-31 11:47:00,3168,"Hey thanks tv4fish! There are folks working on this very issue. I am hoping for some changes to be made in the near future that will help with this ""stupidity at the border""."
1313438,NWwalleye,2011-06-01 10:12:00,223,"Maybe we should re-think the Pleasure Craft Operators card for the non-residents of Canada ..Is a 5 minute boat operator check list enough ????Posted on a local website...------------------------------------------------------------------------Tragic Start to Fishing SeasonPosted by Mike Ebbeling on Tuesday, May 31st, 2011 am 8:49:22 AMProvincial police have identified an American fisherman who drowned in Red Lake.Robert Glick of Highland Park, Illinois, fell in the water while fishing with 2-other anglers last Wednesday.Emergency medical services and police were called to the McFinley Mine dock near Cochenour, where local residents were trying to resuscitate the 58-year old.Police say Glick wasn't wearing a life-jacket.Its been a tragic start to the angling season in Northwestern Ontario.Last week, 2-anglers from Illinois were fishing on Lake of the Woods near Morson when there boat capsized.Police recovered the body of 73-year-old James Wealther.The search continues for 69-year-old Richard Herman. ----------------------------------------------------------------------------A very sad situation .. I feel for these family's losses ..My condolences .."
1313492,JinxCanada,2011-06-01 12:18:00,1306,"Very sad indeed, however, I am sure that even if they had taken the ""online"" boaters exam that would not have prevented this loss."
1313521,cast_and_blast,2011-06-01 13:46:00,1098,"Ok, straight from the MADD Canada site...CANADA It was estimated that 8,103 Canadians died in 2002 due to alcohol consumption (p. 2), accounting for 6.15% of total mortality among those under the age of 70 (p. 93). In 2006, alcohol and/or drugs were involved in 1,278 traffic fatalities, 75,374 injuries and 163,893 property-damage-only crashes (p. 10). The total financial and social costs of these losses were estimated to be as high as $12.8 billion (p. 12).UNITED STATES From 2001 to 2005, an average of 95,695 Americans died annually due to alcohol consumption. Alcohol-involved traffic crashes were the most frequently cited cause, accounting for 14.4% of the fatalities. Using these numbers (above) it can be shown that: 1. Assuming that fatalities remained somewhat static from 2002 to 2006 (probably would have gone up due to increasing Canadian population, but we'll work with what we have), it's approxiamtely 15.7% of the traffic fatalities in Canada had alcohol/drugs involved. 2. As shown for the United States, it's 14.4% of the fatalities (on average from 2001 to 2005) had alcohol involved. So, assuming that these numbers remain somewhat static from 2001 to today it seems like it's Canadians that have a slightly higher rate of fatalities due to drunk/impaired driving, not the Americans. Given, these are stats gathered by MADD. But, assuming they are directionally correct I think we can dispense with Jinx's theory of the ""cavalier attitude of MOST Americans"" towards drunk driving. Still too high and too many tragedies, but it's even a higher percentage in Canada! Here's the PDF from the website : http://www.madd.ca/english/research/real_facts.pdf Facts are so inconvenient, aren't they? Scott"
1313532,jswinter40,2011-06-01 14:14:00,127,Great read Scott. And I would say to Jinx or any others is: come on in to the US if you have had a DUI because we all make mistakes and get caught once in awhile. I do agree with the idea of if you have multiple DUI's you can stay home though. People do need to learn from their mistakes.
1311988,Jack77,2011-05-27 15:46:00,168,"Your attitude regarding U.S. citizens frightens me but only because you are in a position of power. The fact that you project these preconceived attitudes onto all citizens of the Untied States is irresponsible for someone in your position. I would expect more from a federal agent. I believe that we as arrogant, self centered, drunk U.S. citizens we at least deserve the expectation of being judged on our own merits. I wonder why some U.S. citizens dread the border crossing every year? I hope like **** that you don't work in the Sault."
1307386,Marc63280,2011-05-16 06:05:00,309,Do I have to have my boater safety card to get cross the border with my boat?
1307396,Outfitter17,2011-05-16 06:25:00,127,No.
1307423,cruiseforever,2011-05-16 07:44:00,177,Simple and to the point. The type of answer I like.
1307438,Superdad,2011-05-16 07:59:00,64,A visitor to Canada would require a boating card if they spend more than 45 days in the country.
1307502,Dacotah Eye,2011-05-16 09:39:00,2722,Forty five ccnsecutive days.
1307602,Marc63280,2011-05-16 13:20:00,309,Thanks you. Precise and to the point...i like it.
1307630,teddi,2011-05-16 14:19:00,349,if the boat is in canada 45 days not the operator
1311171,JinxCanada,2011-05-25 13:21:00,1306,"the boater safety card is a bull shiiit law designed to milk 4.5 million CANADIANS out of more money. it's nothing but a cash grab. if you rent a boat, you don't need one...if you are not from here...you don't need one. the only people getting screwed with this are our own citizens. It's sickening"
1311179,Jimmy Jig,2011-05-25 13:38:00,1905,"No, you don't"
1311508,Dacotah Eye,2011-05-26 10:03:00,2722,"I think it will be mandatory in the states in the near future also. Whatever happens I already have one even though it isn't mandatory. Being a former search and rescue boat coxswain I don't think I needed the course, but I see a lot of people on the water that are pretty clueless when operating their boat. A lot of insurance companies will give a ten percent discount on boat insurance if you have the card and you will save the cost of the course every year on your insurance after taking it."
