1054011,misfish,2019-12-23 16:45:00,29133,I have all the windows and front door open.  What a beauty of a day to being doing chores and smoking some meat.  I should be fishing. LOL
1054012,lew,2019-12-23 16:56:00,12766,Just got back from my daily 4 mile hike Brian and was over dressed with just a light polyester T-shirt and jacket. Spent yesterday afternoon washing the truck in the driveway. 
1054014,ketchenany,2019-12-23 17:59:00,3229,"I went to SanFrancisco fish market. Think about it Brian! How do you tell and old Italian lady, if I can call her that, that the mussels are alive when they are closed, the owner was almost going to give up!!!!! Merry Christmas to all."
1054025,OhioFisherman,2019-12-23 20:55:00,6623,"58 degrees and light south winds here, a 13.76 walleye caught over the weekend, the fall brawl may have ended, but the walleye fishing hasn't."
1054026,misfish,2019-12-23 20:59:00,29133,"What am I to think about ?  If it,s closed,there's no business happening . Thinkaboutit Albert . HAHAHA"
1054071,ketchenany,2019-12-24 18:28:00,3229,Wall to wall Italians Brian! they did have a jar of caviar and focaccia with an olive oil dip for the people in line!
1054072,misfish,2019-12-24 19:00:00,29133,Starskys had a fresh fish booth. Lined up they were. All for some carp.LOL
