5056818,Stringbean,2016-08-12 22:32:00,279,The city of Dryden picked up just under 6 inches of rain on Friday morning. Many of the city streets are flooded and impassible. Here is the link: http://ckdr.net/news/1341361176/sudd...and-businesses
5056930,Stringbean,2016-08-13 05:41:00,279,Here is a link to the video of Dryden's water problem. https://www.facebook.com/CKDR.Dryden...5418059173219/
5056970,pjshorthorn,2016-08-13 06:14:00,5654,"I bet folks didn't have any choice words for the person that decided to pull into the entrance area of the hotel. Let's see.....we have a flood,so let's push a wall of water into the hotel through the front doors . The wing nut on the positive terminal must have been loose PjShorthorn."
5057002,Stringbean,2016-08-13 06:40:00,279,"In case you had Hwy 502 in your itinerary, you may need to detour. Hwy 594 at the north end of 502 is closed in both directions. This storm did more damage than first realized. Here is the link: http://www.mto.gov.on.ca/english/tra...ml#Event415137"
5057106,Stringbean,2016-08-13 09:19:00,279,Hwy 594 located at the north end of Hwy 502 has been reopened as of 9:50 AM. This includes both directions from the 502 junction.
5058482,farmnfish,2016-08-14 07:52:00,130,"We saw the rest of the day friday was going to be washed out and left a bit early, ended up driving through part of that rain on 594 / ojibway drive . it was quite a downpour."
