998936,limeyangler,2017-04-03 00:00:00,5204,"Hi all,  Had another really crappie morning on Saturday.  "
998937,Old Ironmaker,2017-04-03 00:06:00,8243,Mmmmmgood. What is all that white stuff you are standing on Simon? 16C this afternoon on Ontario's southern coast.
998938,Acountdeleted,2017-04-03 00:16:00,2562,Dear god. Your fishing days are what dreams are made of. Another beautiful day out.
998943,Sinker,2017-04-03 00:50:00,8692,I had a crappie morning too.....from my boat lol
998975,bigugli,2017-04-03 12:28:00,6138,Looks good Simon
998999,Locnar,2017-04-03 18:30:00,645,Right on! I got into a few openwater crappie and bullhead last night.
999029,EC1,2017-04-03 22:33:00,930,Cheers to you for still ice fishing - I wish we had a few more days of ice!
