259697,robinwood,2008-10-19 13:19:00,28,"well, fish were shallow - not large but more than we have ever caught on Thanksgiving weekend in 10 years we caught a fair number like the photos below all LM under a 1lb - hit orange rapalas almost as soon as it hit the surface in 6-8 feet of water over weeds -one family in a nearvy boat thought he had a large Northern on and was very excited when he saw how large it was before it went under his boat and broke off- I quite suspect it was a Musky- since I understand there are few if any Pike in Kasagawiganmog (is that correct) - I told hime it was probably  a Musky and he was very exited - I used our standards of ""if you see it ,it counts"" - since we use barbless hooks - we see lots but do not always get them out of the water - but what a beautiful 3 days for a thanksgiving weekend!  "
259700,limeyangler,2008-10-19 13:24:00,5204,"great report, wow...looks so warm there still...lol...T-shirts...if only. Its hitting minus temps at night now every night....oh well, not long before i'm drillin' holes. Thanks for sharing that tropical thanksgiving report."
259703,BillM,2008-10-19 14:02:00,17367,Nice report!  Looks like you hit turnover at just the right time
259793,Leecher,2008-10-19 19:49:00,7832,Great report and pics robinwood  Looks like a fun weekend on the water Thanks for sharing Leechman
259885,muskie_bob,2008-10-20 01:31:00,13,"Nice fish, I used to fish Kashag a lot and I will agree pike are very rare but there are still some muskie to be found in there."
259928,singingdog,2008-10-20 10:15:00,1047,"If it was a pike, that would be extremly unusual for Kash. There's more than 'some' musky in Kash, there's some monsters in there. That whole chain holds a fair # of musky, and large ones."
259943,b2kptbo,2008-10-20 11:47:00,1505,Glad ya's had a good weekend and most likely was a Musky from that lake...
