84017,Gerritt,2007-06-15 02:31:00,6129,"Sorry for all the ""Reports"" but this guy is UNREAL!     Gerritt."
84018,bigfish1965,2007-06-15 02:34:00,3382,Won't be a problem any more.
84023,Roy,2007-06-15 02:48:00,13728,I think we had him pegged about 30 nano seconds after his first post.
84031,camillj,2007-06-15 03:17:00,1988,Sheesh ... ya turn your back for a few minutes and ya miss everything
84126,ccmtcanada,2007-06-15 12:22:00,7971,See what happens when I go fishing?  I miss stuff like this on the board!! Probably a good thing...
84194,Corey,2007-06-15 16:33:00,355,"ok... someone pm me the dirt on this thread, who, what, where, when, why, etc."
84197,Bernie,2007-06-15 16:37:00,3190,Gad...I hate dialup...Miss all the fun
