873096,Joey,2014-09-18 23:19:00,9122,"Found this in someone's trash (at the curb).   I've met the guy before and know he fishes and even gave me a bunch of crappie before.  Looks like everything is there, no holes, all the poles etc. are in good shape.   What do you think the red modification is for?  IMG_1825 by Joeyfishing, on Flickr  IMG_1826 by Joeyfishing, on Flickr"
873097,Pikeslayer,2014-09-18 23:22:00,1443,Travel through deep snow?. . Is there a prize for correct answer??
873098,Fisherpete,2014-09-18 23:22:00,1814,"My guess is that the Clam shelter broke, and he tried to make skis to pull the sled easier with... Thru 2+ feet of snow apparently lol!!!"
873100,Joey,2014-09-18 23:34:00,9122,"Well both interesting theories     I'm sure we'll find some use for it, or if someone is interested in buying it, let me know."
873101,aplumma,2014-09-18 23:49:00,6896,I'll give you twice what you paid for it.lol You know how much ice fishing we do down here.   Art
873102,misfish,2014-09-19 00:06:00,29133,They call it a smitty sled. Easy travel towing. Many versions by many people. I am working on one myself from an old one man flip over. Nice find J
873174,OhioFisherman,2014-09-19 15:31:00,6623,Santa might need that?
873223,Sinker,2014-09-19 20:11:00,8692,Is that a one man scout?  S.
