827759,misfish,2013-12-31 20:56:00,29133,"The time has finally come.    HARD WATER SEASON   I got a bag of these baits ,and can not wait til the morning to give them a go. Slammers/swammers,look out.  No disrespect to my friend Mark kulick. All in fun.  Read the fine print,as they say.   And no,you can not know the maker or brand right now.  "
827761,BillM,2013-12-31 21:08:00,17367,"Try those in March after the fish have been hassled, then you'll know if they work or not    Early season lakers will eat rope, lol!     Good luck tomorrow, I'd be out but I'm oncall."
827762,misfish,2013-12-31 21:11:00,29133,"Me too,but I left my cell at home.LOL"
827763,BillM,2013-12-31 21:16:00,17367,I like the way you think  :)
827764,misfish,2013-12-31 21:20:00,29133," Hell I,ll try them in May on calm waters,but for some reason,I dont think we,ll be stopping for a chance.  Fish on"
827780,Rustic-Fisher,2013-12-31 21:53:00,826,"We'll be out. I'll shoot ya a text.  good luck, Ry"
