339510,ohhenrygsr,2009-05-09 05:47:00,947,Well my GF got through with rock 95 and Kool Fm for the free Zancor house.  700 Qualifiers showed up with there guest and only 30 numbers where drawn for a chance to win a 250 000 house in barrie.  My GF got 1 outta 30 keys i was in shock it was almost meant to be.  Then the big moment came and gone her key did not open the door .  Better luck next time
339518,Terry,2009-05-09 09:25:00,14456,"that's  too bad  I called and called and called never got in...I have never got in on their birthday bash each year either  but Misfish, his son got in for a key I guess he would have posted if he won ah..... the dreams"
339520,pikehunter,2009-05-09 10:20:00,1659,"Nice prize, if you had won. At least you had a chance and something nice to dream about for a while.  But look on the other side...You didn't really want to move to Barrie anyway, did you?"
339694,Cudz,2009-05-09 21:03:00,2652,called and never got through either.
339702,BillM,2009-05-09 21:40:00,17367, Says the guy from Hamilton   :D
339705,Kenny G,2009-05-09 22:01:00,118,Phew that was close. I would've been freaking! Kenny G.
340000,fishboy,2009-05-10 16:49:00,550,be nice to the hammer now...
