2748513,kzoofisher,2014-05-01 17:20:00,5144,"I don't count fish except for two and those are the ones in the livewell. Having said that, action is a part of why I go to Canada. All of the ingredients of a Canada trip (scenic beauty, quiet, fish, camaraderie, wildlife) are available to me elsewhere, but only in Canada are they available all in one place. I don't need or expect to catch 80-100 fish every day, but I do expect to catch 40-60 most days and I sure like the days when we get 'em non-stop. I don't need or expect to catch half a dozen 6# or bigger each day, but I don't mind getting some big ones. It's a fishing trip and I want to catch fish. More than that I want to catch them on jigs and shield lakes are the place to go for consistent jig bites. I can get drunk at home or at my cabin. I can catch a lot of fish, big ones and of more species right here in Michigan. I can spend quality time with my kids in the same places. I can have a family trip to Quebec, New Brunswick and Maine and bond with them. We can go to the Pigeon River Country or the Sylvania Wilderness and not see anyone else for days while we see elk and eagles and bears and moose and loons and otters and.... you get the picture. The OP asked how many fish a day qualifies as good fishing, if the answer was zero I wouldn't bother going to Canada at all. Some days the fishing is better, some days it's worse, but there has to be that expectation that it will be better on average. Some of the places I've gone have fallen short fish wise, others had plenty of fish but lacked other ingredients. One of these days I'll find the one that is perfect but until then I'll continue to enjoy the search."
2748881,Pikeslayer8,2014-05-01 18:57:00,1460,Amen Brother!
2749401,rockrunner,2014-05-01 21:16:00,205,"It's surprising what qualifies as a good day on the water. I am from Northern Ontario and I have a different spin on this. I feel if your on a lake that offers 150 fish days then your not on a lake that I want to fish. What exactly is the challenge ? Lakes like that, which I am familiar with do not challenge my ability as a walleye fisherman. They do not allow my electronics to work for me. Don't get me wrong if I was coming up to Canada from a office job and was going to fish for a week and go back to work until next year then maybe I would want that 150 fish day experience but if your on this site then your probably more avid than that. I want to be challenged, that's more important to me. I want to be on the lake trying to figure out the bite, do I bottom bounce , pull cranks , rock run, vertically jig etc...worms,minnows leeches etc... What depth are they at etc... I camp on a lake where most don't know there are walleye in it. What I like about it is the fact that it's always challenging but at the same time I have enough tricks in the bag to break the code on the lake 95 % of the time. I started camping on this lake with my wife 9 years ago she has been on the lake fishing it avid with her dad and family for 25+ years. When I take her out with the kids and she says, hey I have never fished here before or I have never fished this presentation or the best one was...if I didn't know I was on this lake, I would swear that I was on a flyin. THAT IS A GOOD DAY TO ME. That's when you know you have put together your experience and knowledge of walleye fishing not when you can pull up to any given wind blowin point and score a 150 walleye. My buddies and I get a charge out of going to not so popular walleye waters or big time cottage lakes and pound walleye like were on some flyin fishing trip on some lake in the middle of know where , while sitting in our Lund Pro V and in comfort. I'm not a big fan of catching walleye that are under 14"" or over 18"" I know where there are big fish and stay clear of those ares . I have no desire to crank in 25-30 inch walleye. When it comes to numbers , as long as I'm getting entertained with a fish every 5-10 min. we're all good. That's just my spin on what is rewarding to me as a walleye fisherman."
2750089,v-bay gord,2014-05-02 06:59:00,3168,"I lean to your point of view RR. I want every fish I catch to be entertaining in some way (challenge, technique, new spot, etc)....not just fish number 79 or 105. Of course we are spoilt living where we do, and for the poor city angler who only experiences it for a week then numbers might be more meaningful. Yes, and what about those pesky 30 inchers..."
2750257,tv4fish,2014-05-02 07:42:00,2694,"Yes, you two are spoiled --- I think you get ""all kinds"" of guys coming up to your great fishing country for a lot of different reasons. For my group of 3 - it is the opportunity to spend a week together and ""catch up"" on what has been going on in our lives over the past year AND have some good fishing. That is something that we do not do otherwise. When we go to Canada on our annual trip - it's something that we have to PLAN. That doesn't happen any other time of the year since we don't live close to each other."
2783001,Kenny_Ross,2014-05-11 19:25:00,103,"Here in Sk I would think a good day is 20-30 per day with avg around 16"". When we go to NW Ontario the no.s are much higher (80-100 per day) with avg around the 20"" mark. The difference is in Sk the big fish of the day is usually bigger than our biggest of day in Ont."
2786641,MuskyMaster,2014-05-12 15:52:00,79,"10 years ago we found a hot spot on the chapleau river in 7fow just jigging, 3 guys in the boat would catch 100 in the morning and 100 at night total without a problem. Then a few years ago my uncle and i were jigging at windemere and it was another 100 fish day with the only problem being we couldn't catch one small enough to keep. Didn't catch any over 5lbs but still a great day. Those are my definitons of a great day of fishing, now i would take one 8+lber over 100 small ones any day."
2798369,CMesserschmidt,2014-05-15 11:58:00,1006,"We had the same question last year. We always heard people say ""200-300 fish a day per person""..... I have been to Canada a few times and I just say BS!!!We had golf shot clickers in the boat, one for each of us, so we kept track of our fish for a couple days just for chits.....Now granted we're not ones to get up at the *** crack of dawn and get out, but we're usually fishing by 8:30-9am and go till the fish stop biting which is usually about 3:30.The first day we didn't use clicker counters, so I would assumed 75-100 fish for me alone and my buddy and his dad agreed.The next day we used the clicker counters and averaged 41 fish per person.Which doesn't seem like a lot, but when you think of setting the hook, fighting the fish, netting, getting the hook out, measuring and a picture, then re-baiting and dropping your jig down only to wait another 30-seconds to a minute or 2 for another fish its amazing that it makes sense.It felt like it was fish after fish after fish, but all that fun stuff in between fish takes up time and really skewed reality.After 2 days of clickers I stopped using them. My hands are so beat to crap from gill plates, dorsal fins and teeth, that my average 41 fish a day is plenty for me. Yeah you get disappointed when you run out of bait but by then I am ready to head in.Get some golf shot clickers to see how your numbers really stack up... I bet you would be surprised. They're cheap to.... like $3-4$ at Wal-Mart."
2798585,MrSimon,2014-05-15 13:20:00,922,So you are only fishing from 8:30 till 3? I bet you could triple your numbers by starting earlier and by fishing the evening bite. But I do agree with you that 40+ fish a day is more than enough .... and its not all about numbers.
2816849,tooski,2014-05-20 14:43:00,393,You must attend a Browns game. After one of those you'll never miscount again.
2816953,IaDave,2014-05-20 15:03:00,476,[QUOTE=phishfearme;2816825]and how could you possibly have time to count?
2817281,octanehi5,2014-05-20 16:49:00,1104,"The penalty is No Soup for you One Yr. The counting is done by both people in the boat, It may be hard for some of you guys who run out of fingers and toes, Mr Simon is correct in zeroing in on the bite takes Yrs. My 11th yr on the same fly to. There are spots on the lake if you miss by 50' you will get nothing. If you never had such a trip with that many fish I suggest you put it on your bucket list, My trip next yr will be the same week, contact me and I will show you personally Next yr.I can only speak for Quebec You will not find better fishing than on Lac Hebert"
2818801,P&y only,2014-05-21 05:46:00,133,"Thanks Jack! Someone who got it. Most of my stories in Canada involve a particular fish, or a bear, or a moose. I truly love the wild outdoors. I do NOT go to Canada to count fish. But if some guy drove 12-14 hours up there and is catching a dozen fish on a ""good"" day, I thought this post might help him realize what Canada is REALLY capable of. Why fish in a dry hole when theres better fishing up the road a few miles. So now that we know how many a ""LOT"" is, let's hear everyones bear story!"
2819801,Guest,2014-05-21 10:17:00,0,"""I've fished several places in Canada. Some better than others. Everybody says ""we caught a lot of walleyes"" But the term ""a lot"" seems to vary immensely. So, my 2 questions are these: 1) When they are biting good, how many do you think you catch in one day? 2) How long is the ""average"" fish you catch? Talking walleyes here. Thanks for replies. Feel free to withhold your fishing spot. I'm not after your honey hole. Just want to do some comparing. "" In my younger years a lot of fish would be 100-150 per day with three people. However, i find that fishing to get very boring rather quickly. Now I only fish lakes where you have shot at true trophy (28+) on every bite. On my favorite lake 25 fish/day with three guys is a lot!"
2799873,mudpusher,2014-05-15 20:14:00,248,only tell the truth when a lie won't fit
2812113,rockape,2014-05-19 12:09:00,215,"We never count. Except once. We hit a walleye sanctuary at 9am the day it opened. We counted for 1 hour, and my partner and I boated 56. I then switched to hunting BIG gators. Success there too. A few have mentioned it in this string. I like the adventure and the whole experience. I always try new spots, new lures, and new techniques. And that pays off BIG TIME. Sometimes I drop my jig to the bottom, crank up 1 turn, and lie down for a nap with my rod in my hand. Always fun truly fighting fish in your sleep! If you have a hot walleye bite that stops suddenly, it usually means a big pike or musky is in the area. I always put down my walleye rod, and start casting the big stuff when this happens. And I usually catch a larger sized gator. I love NW Ontario. I want to catch a decent amount of fish, and big fish too. I always have. But I also want to enjoy the company of my friends, have some good laughs, and create new memories to talk about on future trips. In 4 weeks, I'll be there!"
2812337,Draco1206,2014-05-19 13:04:00,175,"I think we all go to NWO and especially outposts for many different reasons. One of them being to catch more fish than we can normally catch at home. I think counting fish is a barometer only for how the fishing is compared to previous years and how you personally are doing compared to the rest of the group (maybe you're not doing as good as everyone and need to change your methods, or maybe you are doing better then everyone else and need to share your secrets) not a bragging rite. Counting fish and the number, whether high or low has never been a measure for me on how good the trip was. My brother and I once decided to try and catch 100 walleyes one day, we did it but it took all day and I have to say it wasn't that much fun. I have enjoyed some tremendous fishing in my lifetime, from Canada to Alaska to North Carolina to the Florida keys and in my home state of Michigan, and I have also had some horrible fishing days (numbers wise) in those same places. I have never thought that the number of fish is what made the trip a good one or a bad one. There are so many other factors that matter more to me. Number one is just being out there, seeing and enjoying the outdoors. Waking up at the crack of dawn and listening to the loons cry. Watching the sunrise and set. Seeing deer, bears, moose, otter, wolves, lynx and bobcats. Things that most people never see because they are not out there. Number two is being with the friends and family that enjoy those same things. I can only feel pity for those that have never enjoyed the outdoors. We still count our fish every year and post the results on the wall or piece of driftwood for others to see but to answer the question : How many walleyes does it take to make a good trip? I would answer: zero!"
2814273,Jack77,2014-05-20 04:36:00,168,"I know that I shouldn't kick this dead horse but I feel the need to get something straight. The orginal post never asked how many walleye made for a good trip or how many walleye made for a good day. He wanted to quantify what catching ""a lot"" of walleye meant to different people, I have often wondered that myself. Unfortunanley this simple question was mis construed by some as a way to quantify what a good day meant and that poster even went on to apply his confusion to all americans in general. I admit that I got caught up in it as well. All of this becasue the guy wanted to know what ""a lot"" meant, not what a good day meant. I enjoyed reading what a good day meant to everyone, I think it is safe to say that most of us on this forum just enjoy the northern Canadian wilderness."
2815097,rockape,2014-05-20 08:12:00,215,50 walleyes in one day for one person is a lot.
2815225,muskyroller,2014-05-20 08:30:00,56,"35 to 50 constitutes a lot in my opinion... 15 to 20 pike and one over 36 is a lot in my opinion... To me, that would be a lot AND a very good day. Time with family, scenery, beer, etc. is all great but I'm not spending a week away from my girls to not catch fish. Always funny when I hear ""caught our limit."" I hope you did...you're in Canada, not some Metro lake."
2815385,octanehi5,2014-05-20 09:03:00,1104,"Our outfitter, Air Tamarac, on Hebert, requires his clients keep a running total,of type of fish and how many we catch. With two guys in a boat,If we do not catch 100 walleyes in a day its just a so so day, 150 is a good day, 200 is a great day,250 to300 is something that most fishermen only dream about,But has been done on this lake, Last yr the first week in July I set a personal best for the week over 900+ walleye,Thats an average of 130 a day for me. Lac Hebert is a vertual walleye factory,Being only spring fed,only brooks and rivers flow out of the lake. On our last night my friend and I caught 28 walleye in a 100yd drift in less than 15 mins At which point we stopped fishing headed for the cabin for a few Cubins and some Bleue, We sat and smoked and drank not believing what just happened at the end of our trip.The beauty of your trip is in the eye of the beholder,as long as your trip lives up to your expectations. My group is going the 20th -29th of June this yr. I wish you all boat loads of fish"
2816401,Draco1206,2014-05-20 12:19:00,175,"Yeah I agree and also got the wrong message from the original post as it seems everyone was writing what a ""good day"" fishing meant to them, not what ""catching a lot of walleye"" means. So I guess to answer the original question I would say anywhere from 30-50 walleyes a day would be ""a lot"" in Canada in my opinion."
2816513,MrSimon,2014-05-20 12:51:00,922,"I think its important to mention that there are also days when the fishing stinks and catching double digits is a chore and a half. And, we can't just lump all lakes in Canada together. Comparing a remote fly-in lake with excellent habitat to a so-so lake along the side of the highway isn't a fair comparison. Also, it often takes years of going to the same lake over and over to dial-in the technique and spots before you can rack up triple digit days like people are talking about. Not always, but usually."
2816825,phishfearme,2014-05-20 14:34:00,1242,"[QUOTE=octanehi5;2815385]Our outfitter, Air Tamarac, on Hebert, requires his clients keep a running total,of type of fish and how many we catch. what's the penalty for not performing the required counting?"
2798625,phishfearme,2014-05-15 13:33:00,1242,"some not only claim those large numbers you mention but then follow-up with ""and they averaged 21-23 inches"" - both are BS but i think that's expected of REAL fishermen. one guy told me ""they averaged 23 inches"" and I asked him if he didn't catch any small ones? he said ""yah, lots of small ones."" I then pointed out that for every 15incher you get you need a 31incher to average 23 inches - he then said ""the 23inches is the average of the ones we measured"". WOW! ""all fishermen are liars except for you and me, but I'm not so sure about you"" phish"
2739306,prov1800,2014-04-29 18:30:00,5010,Can I come along ???.
2739378,zeebee,2014-04-29 18:38:00,1144,"Truth be known...go back and read my posts. Once earned, I disrespect everyone with the same level of respect."
2739434,zeebee,2014-04-29 18:44:00,1144,"Mid August ..,..bout the time the ice is out. Look out upon outward shore...I be the nimrod....fishin pole in hand.V-Bay...we are too alike. I promise to post a follow-up but this crap bout retiring before we catch moby walleye doesnt make for good drama.I envision you hurling a wee hookless jig into gale force winds and latching onto a 45 inch NP only to have it swallowed by a walleye a couple feet from the boat."
2739474,v-bay gord,2014-04-29 18:51:00,3168,I don't think Zeebee would mind since you are kind of blond....but you should shave your back before the big day.
2739490,10point,2014-04-29 18:53:00,102,"Wow, you guys are catching as many fish in a day as i will catch in a week a lot of times. I know I'm not going to the best area of Ontario as I'm going between Sudbury and Timmons. I'm also only paying $150 a person though for a week of fishing. It's not all about numbers and we enjoy ourselves and are returning to the same place for the 3rd year in a row. We always get enough fish to eat and now that my Son is a teen it's one of the few things he will still with his Dad at this age. I'm not even sure I would want to catch that many fish. It seems like it would get boring catching a fish about every cast."
2739506,v-bay gord,2014-04-29 18:56:00,3168,Ice out is May 15th. I would prefer mid July...mid August may be best suited to bottom bouncers...but I'm game either way. If the fish don't co-operate I always know where there is a shady spot and a cold one!
2739554,zeebee,2014-04-29 19:16:00,1144,"I dont go where the sun dont shine...thanks anyway.Anyhoo...mid Aug and me and my cranks are at their peak. Ill intro you to the long obsolete (tiss a shame) Risto Rap with crawler dressing on the front treble. Yanks like em in #5 size in parrot color for bassin but its the 8 and 9 in silver or gold thatspank the walleye. Has a large side profile that really gets their attention. To me, its the greatest walleye crank ever made. Didnt last cause bass dont feel the same but then again, they're just fish.As for Lakers....Im a bit of a legend. Can catch em even when the guides around me are gettin blanked. Sounds like BS I know, but its true."
2743809,btmbncr,2014-04-30 19:57:00,492,"My wife and I had a discussion about walleye numbers on our walleye fishing trips.She told me she would now rather concentrate on catching bigger walleyes than numbers.Her definition of a ""bigger"" walleye is one over 23 inches.Our experience on Lac Seul is that you can focus in catching bigger fish rather than beat up the numbers fish.She counts fish and sizes so she can rub it in at the end of the day,sometimes.Bill"
2746553,billy weaver,2014-05-01 10:05:00,470,"This has been interesting numbers seem to be the important thing. I will tell you that if I am setting there catching loads of 15"" walleye I am moving. Catching numbers is important but the ""Big One"" is going to make the trip. In your trip to north-west Ontario you will catch walleye catch a 28""+ that should be the goal."
2747409,JDMN,2014-05-01 14:17:00,34,"I honestly enjoy catching any fish, but I have caught enought 16"" walleyes in my life that catching 100 in a day is less important that trying to catch a big one (25""-30""). I would take 15 total walleyes for the day and one 27""er over 100 fish in a day with none over 22""."
2737450,zeebee,2014-04-29 13:00:00,1144,Yes. Enuff said.
2737522,v-bay gord,2014-04-29 13:15:00,3168,You're on....I'll drive. You bring the moose meat. Walleye or lake trout?
2737658,JayM5209,2014-04-29 13:34:00,1050,"zeebee, take him up on it. It'll be worth the drive for sure!"
2737682,Nimstug,2014-04-29 13:38:00,2605,My son and I use this system: None = none A couple = two A few = 3 to 5 or so Some = about 8 maybe a couple more A lot = an amount more than Some. A boatload = way more than a Lot. A buttload = whatever we decide is is that day. Nimstug...simple and very accurate.
2738306,phishfearme,2014-04-29 15:12:00,1242,"VERY impressive - even unbelievable! we wouldn't call this a ""good bite or day"" - this would be one in a billion for us. for the smaller flyin lakes we do, getting to 40-50 a day each is a good day - average would be 16-17inches - with a handful each day over 20. a trophy is 26/27+. phish"
2738930,P&y only,2014-04-29 17:04:00,133,"Zeebee, when I read most of your posts you seem like a nice fun loving guy. But then you lump all Americans into a pile of worthless score keepers. Why the hate for us?I love to be in the wild, away from cities whether in Canada or here at home. I come to Canada. Drop my thousand dollars into your economy. Eat a few walleyes. Take 0 home and don't leave my shtuff floating in your waters. I asked for numbers to compare one place to another. I have never counted the fish I caught but I darn sure like fishing where there are good numbers rather than a dead lake. So what makes you so sour towards us Americans? Do you regularly see Americans disrespecting your fishing resource? If so, that's disgusting. But please don't lump us all into that category. Are all Canadians the same??"
2738970,The Donger,2014-04-29 17:16:00,48,Holy Cow P&Y. Stop poking the bear. We had just gotten him calmed down.
2739074,prov1800,2014-04-29 17:35:00,5010,"all Americans into a pile of worthless scokeepers. Why the hate for us? I love to be in the wild, away from cities whether in Canada or here at home. I come to Canada. Drop my thousand dollars into your economy. Eat a few walleyes. Take 0 home and don't leave my shtuff floating in your waters. I asked for numbers to compare one place to another. I have never counted the fish I caught but I darn sure like fishing where there are good numbers rather than a dead lake. So what makes you so sour towards us Americans? Do you regularly see Americans disrespecting your fishing resource? If so, that's disgusting. But please don't lump us all into that category. Are all Canadians the same??[/QUOTE] Great question, can't wait for the answer.h"
2739114,v-bay gord,2014-04-29 17:39:00,3168,"I will take that as a gracious acceptance on your part to troll for some walleye (I don't know you well enough to share the secrets of trolling for lake trout.....I would have to kill you afterwards). Some concerns have been expressed by our American neighbors that in your case it is best to let sleeping dogs lie. I think some bonding between us may have a calming effect. You may even want to start counting your walleye.......although, be forewarned. I am a lazy fisherman, and have been known to retreat to shore for cocktails after catching only one walleye (who needs more, after all?....besides your prostate may be a limiting factor). Send me a pm and we can work out details of this mini adventure. The WC brethren will anxiously be awaiting your report."
2739210,forgop,2014-04-29 18:04:00,880,"Last September, I would say ""not very many""... When you only catch enough wally's that your group of 4 have enough to eat 1 meal/day and struggle to catch your limit to take home without trowing many back, it's not too many. The northern on the other hand got tiresome."
2736578,Jack77,2014-04-29 09:31:00,168,"""CANADA 1 USA 1 Can't wait for overtime score"" Love itI had no idea that we had ""world representative"" among us, truly an honor.I really don't think this thread was about keeping score, at least it wasn't for me. It was just a way to qualify what was considered ""good"" fishing since the term is so subjective. Maybe trying to quantify the term upset zeebee. I understand what he is saying but really he is being hypocritcal, he doesn't want anyone telling him what a ""good"" day is but has no issue getting after others when they want to offer what a good day is to them. Live and let live Zeebee, that is what it really means to be an American."
2736658,Ranger319,2014-04-29 09:51:00,166,"Well said. I have several relatives/friends that go to Canada every year and they will catch around 10-20 or so a day, a HUGE walleye to them is 24"". But guess what, if makes THEM happy and they consider it a ""good"" day, that is all that matters. Whether you catch 1 or 500, as long as you are happy that is all that matters. If you don't want to keep track of how many fish you catch, go for it. If you want to keep a note pad and document on every fish caught, more power to ya. It boils down to doing what YOU want on YOUR trip and hopefully everything turns into a ""good"" day for you."
2736722,prov1800,2014-04-29 09:59:00,5010,"Well put.I noticed on zeebee profile he is not from NWO, in fact he is from manitoba so in some manner of speaking he himself is like a visitor to our great province, be nice zeebee were all after the same enjoyment."
