2736906,zeebee,2014-04-29 10:26:00,1144,From the country that brought you Nescafe and Sanka...too funny.Well at least I got you smellin the coffee....time you boys walked away from the instant crap (more bigger faster) and figured what it is all about.
2736922,zeebee,2014-04-29 10:30:00,1144,"Live and let live Zeebee, that is what it really means to be an American.Might I add...""regardless of how many weapons it takes to prove this point"".This is so funny it needs to be reposted."
2736946,zeebee,2014-04-29 10:36:00,1144,"I am nice...just too old to slip on a blindfold and bend over. Unless of course your 5'10"" a blonde and wearin leather and not 'causa the weather."
2737074,JayM5209,2014-04-29 11:09:00,1050,"prov1800, you just have to quit telling everyone about Cliff Lake!!"
2737162,prov1800,2014-04-29 11:30:00,5010,"Sorry jay,haha."
2737282,Lafayette,2014-04-29 12:09:00,4,"What's a good day? Just being in NWO is a good day, catching fish is a bonus."
2737322,zeebee,2014-04-29 12:16:00,1144,"Funny huh. A little Prep H and it wont be so bad.Why dont you invite me out for a day or two of trolling cranks.I'll pay.And live to report back on this site. Make sure you are wearing a life vest.Kiddin aside....I hear you run a great camp, and I dont sing many accolades."
2735642,zeebee,2014-04-29 06:39:00,1144,"You wake up when your body says its time. Go for a pee. If your my age ....you curse your prostate to no avail. Start the coffee percolating on the stove. When the fragrance tells you its ready you pour a cup and walk out onto the deck to absorb the sun into your body. The water looks glorious.The activity in other cabins mimics your own....slow and relaxed. Give yourself a moment.Eventually, think about where you will be fishing and what gear you will be taking......there are no other thoughts. Have another coffee and realize you are the luckiest person on the earth. It just doesn't get any better. Size? Numbers? They will be there. Leave your mindset at home otherwise, you miss the whole point.Sigh."
2735826,SinOrSwim,2014-04-29 07:18:00,1528,LOL well played............well played
2735890,zeebee,2014-04-29 07:32:00,1144,You americans need to keep score on everything you do..size ..numbers whatever. The world is getting tired of it....dont you have anything else to offer?
2735898,Jack77,2014-04-29 07:33:00,168,"Everyone is going to have their favorite but after visiting many different camps and using several different outfitters we have settled on Brace Lake Outfitters to be our place. The combination of great fishing, accamodations, and excellent service by Kyle and Teri have us sold. I would highly recommend them to anyone. http://www.bracelakeoutfitters.com/index.html"
2735946,sept61,2014-04-29 07:40:00,91,I love this^ My thinking exactly!
2736002,Freytown,2014-04-29 07:47:00,770,"Not all of us Zee. Actually counting fish isn't even on my radar when visiting the north woods. Heck, at my age, I wouldn't remember anyway, lol. I love the your post above...agree 100%."
2736394,Ranger319,2014-04-29 08:53:00,166,"You canadians and your need to tell everyone else how to live their life, how to think, how to enjoy THEIR vacation, whatever. The world is getting tired of it....don't you have anything else to offer?"
2736418,Mike Kansas,2014-04-29 09:03:00,1463,CANADA 1 USA 1 Can't wait for overtime score
2736530,v-bay gord,2014-04-29 09:23:00,3168,Quit thinking like me Zeebee. It's really irritating.
2736554,v-bay gord,2014-04-29 09:25:00,3168,How 'bout Justin Beiber with his pants hanging half off his butt? Now that's an offer you just can't refuse.
2734169,Guest,2014-04-28 17:45:00,0,"On the Cabonga Reservoir in Quebec during the good years when they didn't mess with the water level, we would have our traveling fish, 6 at around 20 inches after the first day. We didn't keep count after that because we switched to lake trout and pike. We never went for numbers but enjoyed seeing different parts of the reservoir and on occasion seeing some really neat wildlife. But in the end it comes down to catching walleye and when they messed with the water level, it killed the walleye and pike fishing we enjoyed. I hope to go back some day and relieve past trips."
2734225,LoDo,2014-04-28 18:00:00,721,"Agree with all this we fish a primarily private lake (only three cabins) and never have an issue catching walleyes. Pre, during or post spawn, bring it on! I can't imagine there are more than 500 fisherman on this lake annually. We often times like to explore new areas which may damper our walleye count, but sometimes exploring is part of the NWO experience. Last year, second week of June, a few of us starting fishing new spots and absolutely crushed walleyes in spots that were never marked on the ""hot spot map"". 23 days and counting! Still need some warm weather!"
2734409,jimmie,2014-04-28 18:56:00,123,"I usually fish alone and on one occasion I caught 49 'eyes and another fish in just over two hours over a sunken reef. I'll let you guess what the other fish was to end my run of good luck ? Some guuys brag about how as a group they caught 125/150 walleyes in a day. Others the 30 incher. To me I brag about the great day I had on the water and the adventure that I enjoyed. I keep track somewhat in general for future reference. Just recall one of my first trips to Lac Seul and came upon what I affectionately refer to as hole ""49"". Oddly enough I stop by this area every trip and once in a great while I'll catch an 'eye. Never repeated my luck that day in such a short period of time. I hunt for the bigeer ones now. My largest has been 28 1/2"" 'eye and 20 1/2"" smallie and 39 1/2"" Northern to date. So much water so little time. Gudied boats have topped 125 many times for four people but after shore lunch they more often than not throw spoons for big pike."
2734714,Pikeslayer8,2014-04-28 19:50:00,1460,"That's what she said! Sorry Sin, you just put it on a tee! Lol I pretty much agree with everything said on this thread about good days on a good Canadian lake. 100 fish days are not uncommon but I can think of a few times up there so extraordinary, so spectacular that I dare even tell. The time was 23 years ago on my honeymoon trip to Shikag. My wife and I portaged into this little lake off Shikag called Ted's Lake. Twas one of those deals where the fish would bite anything. We were both using Fuzzy Grubs tipped with crawler and couldn't get our respective jigs to the bottom. Wasn't long before we tired of putting on crawler and still couldn't hit bottom. Was so fast and furious that in no time at all, the walleye ate the plastic bodies off the jigs. Still didn't hardly make a difference. I'd venture to say that as a boat, we caught 500 fish that day but nothing over 16""."
2734746,walleye IA,2014-04-28 19:53:00,129,"This a good topic. I have wounder the same thing. I remember a time when the bite was so good. I used a jig tipped with a Slim Jim, and one after anther. We still laugh about that day.These 80-100 fish day are spacial!"
2734922,billy weaver,2014-04-28 20:25:00,470,"I have been fishing north-west Ontario for nearly 30 years, 26 years at the same camp. While I consider myself an average fisherman at best there are areas where we catch 60 to 80 walleye a day, average 18 to 22"" is the norm. While this a good area I don't feel it will give me a 30""+ fish. There is another area that gives me few if any fish but one was 31 1/2"". I always give it some time every year. (one fish is all I want). In later years I take out one day for smallmouth and one for pike. THIS WILL BE THE YEAR 5TH WEEK OF THE SEASON."
2735410,Jack77,2014-04-29 05:44:00,168,"Nothing new to add really but I agree with the majority of posts. 100 walleye a day per guy is a good day. Last time up to Brace Lake we actually had a difficult time catching fish below 18"" to eat, most were between 18- 24"". We will sometime get bored catching fish after fish in spots and go hunting new spots or troll just to take a break. An average day would be somewhere between 60-80 fish a day. We do take a long shore lunch break every day just to get together to compare notes and plan the afternoon. I would agree that if you are only catching your limit than you need to find a new place to fish. We can fish off the dock at our outfitter and catch a limit in 20 minutes. The record off the dock is 47 casts with 47 walleye in a row."
2735442,P&y only,2014-04-29 06:02:00,133,Hopefully this post will help someone see that they should try other places if they are only catching a few each day. Canada has so much to offer. Just be sure to treat the resource with respect.
2735474,troutwater,2014-04-29 06:14:00,299,"This is a great thread. I've always wanted to do a fly in sometime, but really have no idea what to expect....or where to go for that matter. What are some of the outfitters everyone has used?"
2735522,prov1800,2014-04-29 06:19:00,5010,"As a guide the last thing I would want to do is count fish every day.I usually loose track aftet 6-7 fish.some of my guests have counters but you still have to remember to click the counter.doesnt matter which lake I happen to be on a particular day my routine is 10 dozen minnows a day for 2-3 guests and myself.sometimes we run out of bait by 1 or 2 in the afternoon or some days we have some left, everyday day is different, depending on weather or wind conditions, some days I fish lakes that are hard to catch to catch walleye but the ones we catch are huge, so we dont catch to many that day, but every one takes about having had a great day, I guess everyone has different ideas about a day of fishing.if goal is to boat 100 a day you could be in fora lot of ddisappointments."
2731913,P&y only,2014-04-28 08:57:00,133,"I've fished several places in Canada. Some better than others. Everybody says ""we caught a lot of walleyes"" But the term ""a lot"" seems to vary immensely.So, my 2 questions are these:1) When they are biting good, how many do you think you catch in one day?2) How long is the ""average"" fish you catch? Talking walleyes here. Thanks for replies. Feel free to withhold your fishing spot. I'm not after your honey hole. Just want to do some comparing."
2731953,The Donger,2014-04-28 09:08:00,48,"I catch enough that after about five days I am trying to find something in my tackle box that won't catch fish just for the heck of it. I never keep count but it is pretty difficult to catch fewer than 20 per day on a decent lake and 40+ is probably the norm if you are trying at all. We catch plenty of eaters and a whole bunch over 20"" and I think the largest one of our crew has caught is 27"". Catching walleyes in NW Ontario is not a problem."
2731993,Ranger319,2014-04-28 09:14:00,166,"1) On a good bite, average would be 100 Walleyes or so a person. Have had times when that number was closer to 150 walleyes per person. Typical day with 2 in my boat we catch around 100-125 walleyes total. If I get on a crankbait bite, especially casting, that number can increase pretty quick. On the flip side of that, we've had 2 seperate weeks were the 2 of us didn't catch 150 total for the week! 2) Average size is about 21"". For the past 4-5 years, we've had troubles finding fish below the slot. Towards the end of the week we had to change our approach and search for smaller fish. Still no 10lb or 30"" walleye...yet!"
2732001,Golden Eagle,2014-04-28 09:16:00,2642,"Anything over half a ton for two guys on a 7 day trip would be flirting with ""a lot of walleyes""."
2732097,Mike Kansas,2014-04-28 09:45:00,1463,"Best I have ever seen was on a fly in with eight of us. The place we went to was a river with 5 lakes attached to it. The water was 10' low and the Walleye had moved out of the lakes into the river and we literally caught eyes all day every day. 20 to 25 fish per hour per man was the norm. Actually tried to find spots that we had to ""fish"" for them instead of just setting hooks and pulling them in. Worst ever was two of us only caught 170 in 5 days. Average fish runs 20"" and biggest ever was 35"". Mike Kansas"
2732145,LoDo,2014-04-28 09:56:00,721,"Lets assume two in a boat x 10hrs/daily. I'd say ""a lot"" is 80+ combined fish per day. With all the props hitting rocks, lines in the motor, snags, lost tackle, birds nest in spoils, casting lines that get caught on shore, moving around, drinking, laughs, etc... 8+ fish per hour is pretty solid. That's two every 15mins! Now, we have had our moments where we are catching a fish every cast. Insane! Avg fish is 21"". The largest walleyes caught within our group is 28-30""."
2733465,SinOrSwim,2014-04-28 15:18:00,1528,"I have never kept count. For us, it's one of those we know it when we see it. For instance, some think great fishing is 100 per day. I can't imagine a ton of those fish are 20-22"" or bigger. But, then again if you catch fewer fish in a day but most of those are 22"" to 27"" that is a very good day.Say you fish 10 hours per day. I don't know how one catches 10 fish per hour for 10 straight hours? One fish every 6 minutes??? You have snags, you have to move around, drive in and out to your spot, bait hooks, take fish out of nets etc. Unless you find a spot where you are essentially dipping it down and pulling them out like you would perch or bluegills. But, my guess is those fish aren't very big.So, it's not about numbers or size alone. It's a combination or the two."
2733569,kzoofisher,2014-04-28 15:41:00,5144,"Total numbers depends entirely on how many hours you fish, but I would say that averaging 6-8 fish per hour is a good day. There will be that lull where you are looking for a school and that flurry where you are pulling them in so fast you never put the net away and it will average out fine. I don't think you can pile up the numbers as fast trolling as you can casting cranks or jig and plastic, there's just too much time reeling them in from 100' back and re-rigging to put one in the boat every 8 minutes, let alone every three or four minutes when you are on a shallow water bite. On the other hand, some days are insane and defy explanation. It's really good to have one or two of those each trip."
2733705,P&y only,2014-04-28 16:07:00,133,"I mostly asked so others could see the numbers. I know the place I went to first, years ago I thought was awesome because I could limit out most days. After trying different places I soon learned that that place was a waste of my time and money. But if you have nothing better to compare it to, you might think you are in a good place when in reality you are not. The place I go now is Soooo much better. 6-8 walleyes an hour would be easy to do in late may and early June. EASY to do. But I can't stay there all day knowing theres 40"" pike and 5 lbs smallmouth swimming around. I just wish I had known that the first place wasn't (normal) Canada fishing a little sooner. Thought this might help others avoid the same."
2733969,bigwalleye1,2014-04-28 16:57:00,2632,"""because I could limit out most days"" Glad your criteria has changed. I've done that while waiting for the other boat to quit dinking around and get moving in the morning. Seriously, though, for numbers, my target is 100 walleyes per day for my boat (2 guys). Usually allows for a nice mix of eaters, over slots and a few hawgs (27+) Most days, we're pretty close. Every once in a while, there are those days where you'll talk about it as long as you walk the earth, but that's another thread...."
