868057,davey buoy,2014-08-17 20:28:00,5505,"Started dipsy's diving around 6:45am ,spent about four hours doing that.Marked tons of fish all day in the 40-50' range. A couple hits and a nice Perch in 53' of water for myself lol. Shaun(xx goaler) and I decided let's jig in a area we found which was almost constant beeps and fish throughout the column. I start at the bottom,him at 40',I'm in 121'.and he gets a hit. A real nice and respectable 9lb laker for table fare.Nice job bud!!   "
868059,misfish,2014-08-17 20:35:00,29133,"If you look way back behind him,you will see Terry and I floating about. i knew we seen you out there.LMAO  Nice fish and eater Dave.  We marked lots today as well,but hard to hold on them in a toon with stupid crazy current.  Well done byes."
868085,xxgoaler,2014-08-17 23:40:00,106,"\great job of netting Daveybouy, Thanks for the great day"
868144,limeyangler,2014-08-18 12:33:00,5204,Nice fish there Daveybouy….must get me a smoker next year.
868592,googleme,2014-08-20 23:32:00,25,Great Job Davey Buoy!!  Lakers are so beautiful!
868597,spincast,2014-08-20 23:56:00,3279,"that makes for a good day on the water  - keep working those dipseys - they take a while to zone in, but once you get them figured out they are very productive"
